Id,Title,FavoriteCount,ViewCount,tag1,Tag2,Tag3,Tag4,isProblematic
"=HYPERLINK(""https://stackoverflow.com/q/326366"", ""326366"")",Experiences with Zoho Creator?,,2106,Platform issues,Database [connection| sclability| model design| Export/import data| Database design| DB scalability| DB Admin Authorization|,,,
"=HYPERLINK(""https://stackoverflow.com/q/359717"", ""359717"")",What's the best free resource to learn about Ms IIS?,1.0,329,Queries on Platform [plaform comparision | platform features],Tutorial [How to do this ],,,
"=HYPERLINK(""https://stackoverflow.com/q/544097"", ""544097"")",Create lightning in OpenGL ES 1.1,1.0,3207,,,,,
"=HYPERLINK(""https://stackoverflow.com/q/980932"", ""980932"")",Python QuickBase API Help,1.0,1263,API Integration [Updating Integrated API versions | API unexpected response | Connecting external services | Ambiguous sample code integration],Debugging Error/crash [why this does not work| Application Code change not executed| Broken UI| Functionalities not working| boken UI| ],,,
"=HYPERLINK(""https://stackoverflow.com/q/1236439"", ""1236439"")",How do generate screen elements dynamically in the OutSystems platform?,1.0,2655,Application Customization [QR code | Automatic value| Show/Hide Component| Pagination],Dynamic Content,,,label not inserted
"=HYPERLINK(""https://stackoverflow.com/q/1258834"", ""1258834"")",Integrating CRM with Google maps,1.0,3802,Tutorial [How to do this ],API Integration [Updating Integrated API versions | API unexpected response | Connecting external services | Ambiguous sample code integration],,,feature implement 
"=HYPERLINK(""https://stackoverflow.com/q/2022549"", ""2022549"")",Using Javascript/jQuery to access HTML elements with improper id attribute,0.0,1627,General programming query [JSON to CSV/excel],,,,
"=HYPERLINK(""https://stackoverflow.com/q/2377082"", ""2377082"")",XCelsius using ZOHO webservice,,331,API Integration [Updating Integrated API versions | API unexpected response | Connecting external services | Ambiguous sample code integration],,,,
"=HYPERLINK(""https://stackoverflow.com/q/2566385"", ""2566385"")",SlimDX: Lightning problem with Direct3D9,,1453,,,,,
"=HYPERLINK(""https://stackoverflow.com/q/2615337"", ""2615337"")",Lightning effect in opengl es,,1315,,,,,
"=HYPERLINK(""https://stackoverflow.com/q/3016015"", ""3016015"")",Are there any serious pitfalls to Outsystems Agile Platform?,3.0,20409,Queries on Platform [plaform comparision | platform features],,,,
"=HYPERLINK(""https://stackoverflow.com/q/3578981"", ""3578981"")","How does one make a point to point ""bolt"" of lightning using perlin noise or other algorithm?",3.0,3767,,,,,
"=HYPERLINK(""https://stackoverflow.com/q/3700594"", ""3700594"")","Simple Integration - ZohoCRM, HighriseHQ, PipelineDeals",,600,API Integration [Updating Integrated API versions | API unexpected response | Connecting external services | Ambiguous sample code integration],,,,
"=HYPERLINK(""https://stackoverflow.com/q/3906522"", ""3906522"")",APIs for implementing Document Editing and viewing features for a web app?,1.0,1974,Tutorial [How to do this ],,,,
"=HYPERLINK(""https://stackoverflow.com/q/3990732"", ""3990732"")",Reviews on these RAD tools,1.0,1146,Queries on Platform [plaform comparision | platform features],,,,
"=HYPERLINK(""https://stackoverflow.com/q/4432075"", ""4432075"")",Floating exponent exponentiation algorithm,1.0,1728,General programming query [JSON to CSV/excel],,,,
"=HYPERLINK(""https://stackoverflow.com/q/4439797"", ""4439797"")",How to implement exponentiation of a rational number without nth root?,1.0,626,General programming query [JSON to CSV/excel],,,,
"=HYPERLINK(""https://stackoverflow.com/q/4556252"", ""4556252"")",Open documents in browser with zoho api,,1232,Permission,API Integration [Updating Integrated API versions | API unexpected response | Connecting external services | Ambiguous sample code integration],,,
"=HYPERLINK(""https://stackoverflow.com/q/4598926"", ""4598926"")",Send php form to 2 locations,,1100,Data binding,Tutorial [How to do this ],,,
"=HYPERLINK(""https://stackoverflow.com/q/4804623"", ""4804623"")",Moodle - Zoho CRM Integration,,1086,Tutorial [How to do this ],Application Customization [QR code | Automatic value| Show/Hide Component| Pagination],,,
"=HYPERLINK(""https://stackoverflow.com/q/5552901"", ""5552901"")",Link between zoho crm and Moodle,,446,Tutorial [How to do this ],,,,
"=HYPERLINK(""https://stackoverflow.com/q/6580311"", ""6580311"")",How to create custom reminders in lighning with javascript?,,1295,,,,,
"=HYPERLINK(""https://stackoverflow.com/q/6645196"", ""6645196"")",How to get todos from Thunderbird/Lightning calendars?,,424,,,,,
"=HYPERLINK(""https://stackoverflow.com/q/7048854"", ""7048854"")",How to retrieve FeedComment using Chatter SalesForce WSDL service in C#,2.0,1669,Tutorial [How to do this ],General programming query [JSON to CSV/excel],,,
"=HYPERLINK(""https://stackoverflow.com/q/7304006"", ""7304006"")",File Upload using Chatter REST API,,3381,API Integration [Updating Integrated API versions | API unexpected response | Connecting external services | Ambiguous sample code integration],Debugging Error/crash [why this does not work| Application Code change not executed| Broken UI| Functionalities not working| boken UI| ],,,
"=HYPERLINK(""https://stackoverflow.com/q/7383641"", ""7383641"")",How to post a new thread and new comments to a current thread in iOS to Salesforce's Chatter feed,,250,Tutorial [How to do this ],,,,
"=HYPERLINK(""https://stackoverflow.com/q/7679733"", ""7679733"")",How could I 'attach' an ASP.NET byte array to a 'file' type input field on a form?,,485,,General programming query [JSON to CSV/excel],,,
"=HYPERLINK(""https://stackoverflow.com/q/7699717"", ""7699717"")",Salesforce Oauth 2.0 Authorization screen,,1205,,Session/Authentication [social auth | oaut2 | jtoken],,,
"=HYPERLINK(""https://stackoverflow.com/q/7839597"", ""7839597"")",Can I mention a group of users on a Salesforce Chatter post?,,2237,Queries on Platform [plaform comparision | platform features],,,,
"=HYPERLINK(""https://stackoverflow.com/q/8005085"", ""8005085"")","convert xml response (from ZohoCRM) to simple ""key=value"" pairs (for SurveyGizmo) using php or Zoho Creator",1.0,2072,General programming query [JSON to CSV/excel],,,,
"=HYPERLINK(""https://stackoverflow.com/q/8040701"", ""8040701"")",Salesforce apex - how to determine if a field is set to be tracked in Chatter?,,1119,Application Customization [QR code | Automatic value| Show/Hide Component| Pagination],,,,
"=HYPERLINK(""https://stackoverflow.com/q/8067099"", ""8067099"")",How to add Search layouts in Salesforce package,,4143,Tutorial [How to do this ],,,,
"=HYPERLINK(""https://stackoverflow.com/q/8123314"", ""8123314"")",Posting data in PHP Curl,,763,General programming query [JSON to CSV/excel],,,,
"=HYPERLINK(""https://stackoverflow.com/q/8430681"", ""8430681"")",Chatter : getDeleted EntitySubscription and FeedLike,,489,Documentation [incorrent| incomplete| ambiguous| Ambiguous sample code integration],,,,
"=HYPERLINK(""https://stackoverflow.com/q/8430696"", ""8430696"")",Chatter : SOQL for fetching CommentLikes,,2369,Database CRUD [Complex Database query| DB query for M:M data model| DB query unexpected| ],,,,
"=HYPERLINK(""https://stackoverflow.com/q/8522884"", ""8522884"")",Java Client Consuming .NET WCF over SSL (WS-Policy not supported),,3176,wrong tag,,,,
"=HYPERLINK(""https://stackoverflow.com/q/8640940"", ""8640940"")",Rendering realistic electric lightning using OpenGl,2.0,6008,,,,,
"=HYPERLINK(""https://stackoverflow.com/q/8657698"", ""8657698"")",Detect Whether User Is Running Sales Or Service Cloud On Salesforce,,634,Tutorial [How to do this ],,,,
"=HYPERLINK(""https://stackoverflow.com/q/8980486"", ""8980486"")","Zoho Remote API - cannot save files back to our server - ""Document format not supported. Error in saving content.""",,611,Debugging Error/crash [why this does not work| Application Code change not executed| Broken UI| Functionalities not working| boken UI| ],,,,
"=HYPERLINK(""https://stackoverflow.com/q/9041860"", ""9041860"")",Using third-party SDK's for Objective-C in Xamarin?,,748,Queries on Platform [plaform comparision | platform features],,,,
"=HYPERLINK(""https://stackoverflow.com/q/9054254"", ""9054254"")",OAuth lib for Chrome Extensions and Salesforce API,1.0,413,,Session/Authentication [social auth | oaut2 | jtoken],,,
"=HYPERLINK(""https://stackoverflow.com/q/9076585"", ""9076585"")",How to work with quickbase queries,,1357,Tutorial [How to do this ],API Integration [Updating Integrated API versions | API unexpected response | Connecting external services | Ambiguous sample code integration],,,
"=HYPERLINK(""https://stackoverflow.com/q/9139207"", ""9139207"")",I have found this error while am adding data to quickbase database?,,385,Debugging Error/crash [why this does not work| Application Code change not executed| Broken UI| Functionalities not working| boken UI| ],,,,
"=HYPERLINK(""https://stackoverflow.com/q/9168994"", ""9168994"")",SOQL - Querying for a list of users the current user is following,2.0,14718,Database CRUD [Complex Database query| DB query for M:M data model| DB query unexpected| ],,,,
"=HYPERLINK(""https://stackoverflow.com/q/9187799"", ""9187799"")",Salesforce-Cross Object Field,,431,Database [connection| sclability| model design| Export/import data| Database design| DB scalability| DB Admin Authorization|,,,,
"=HYPERLINK(""https://stackoverflow.com/q/9257823"", ""9257823"")",How do i do the following task with quickbase?,,302,,,,,
"=HYPERLINK(""https://stackoverflow.com/q/9372228"", ""9372228"")",cant call api method using xml in url,,588,,,,,
"=HYPERLINK(""https://stackoverflow.com/q/9391137"", ""9391137"")",Can servers block curl requests?,15.0,39930,General query [HTTP error header message  explanation | Feature usage query | Learning curve],,,,
"=HYPERLINK(""https://stackoverflow.com/q/9481841"", ""9481841"")",Create textbox (label) with click on link Javascript,,834,,,,,
"=HYPERLINK(""https://stackoverflow.com/q/9588748"", ""9588748"")",QuickBase Perl API: Not able to edit a Record,,345,,,,,
"=HYPERLINK(""https://stackoverflow.com/q/9766725"", ""9766725"")",new line character in product description,,1973,,,,,
"=HYPERLINK(""https://stackoverflow.com/q/9802779"", ""9802779"")",how to enable files api in salesforce integration project?,,855,,,,,
"=HYPERLINK(""https://stackoverflow.com/q/9959449"", ""9959449"")",Using PHP to insert records to Zoho CRM via the API,,12389,Documentation [incorrent| incomplete| ambiguous| Ambiguous sample code integration],,,,
"=HYPERLINK(""https://stackoverflow.com/q/9980294"", ""9980294"")",Quickbase API returns data in CP1252 encoding but says it's returning UTF-8,,623,,,,,
"=HYPERLINK(""https://stackoverflow.com/q/10042002"", ""10042002"")",SQL Query Issue Sum,,684,,,,,
"=HYPERLINK(""https://stackoverflow.com/q/10152372"", ""10152372"")",how to add QuickBase a CodeIgniter,,247,,,,,
"=HYPERLINK(""https://stackoverflow.com/q/10170940"", ""10170940"")",salesforce rest api,1.0,5120,,,,,
"=HYPERLINK(""https://stackoverflow.com/q/10215293"", ""10215293"")",Can I add a custom widget to Salesforce Service Cloud Console?,,2499,,,,,
"=HYPERLINK(""https://stackoverflow.com/q/10247749"", ""10247749"")",Exporting tables from QuickBase,,2485,,,,,
"=HYPERLINK(""https://stackoverflow.com/q/10476572"", ""10476572"")",How to get records from Quickbase in asp.net application?,,2320,,,,,
"=HYPERLINK(""https://stackoverflow.com/q/10557731"", ""10557731"")",QuickBase jQuery/Ajax call puzzler,,1753,,,,,
"=HYPERLINK(""https://stackoverflow.com/q/10586848"", ""10586848"")",Salesforce API Requests number keeps increasing,,812,,,,,
"=HYPERLINK(""https://stackoverflow.com/q/10673123"", ""10673123"")","UrlFetchApp fetch post to Zoho Creator API, Zoho needs the session to be closed",,499,,,,,
"=HYPERLINK(""https://stackoverflow.com/q/10690115"", ""10690115"")",How to build a Bridge and sync magento and zoho both ways,,1208,,,,,
"=HYPERLINK(""https://stackoverflow.com/q/10761717"", ""10761717"")",add new section to lead to call api depending on the lead url,,66,,,,,
"=HYPERLINK(""https://stackoverflow.com/q/10774183"", ""10774183"")",Light Rendering Results in Low FPS,,192,,,,,
"=HYPERLINK(""https://stackoverflow.com/q/10784169"", ""10784169"")","Get Zoho CRM PickList (Lead Source,Industry, Currency , etc..) values via API",,1590,,,,,
"=HYPERLINK(""https://stackoverflow.com/q/10898993"", ""10898993"")",put a page break when specific chracter found in visual force,,1375,,,,,
"=HYPERLINK(""https://stackoverflow.com/q/10919857"", ""10919857"")",simple xml not working on live server,,1596,,,,,
"=HYPERLINK(""https://stackoverflow.com/q/10923870"", ""10923870"")",Is this a normal xml format?,,1838,,,,,
"=HYPERLINK(""https://stackoverflow.com/q/10930561"", ""10930561"")",Save Zoho Creator form in crm and in mysql database,,1142,,,,,
"=HYPERLINK(""https://stackoverflow.com/q/11064969"", ""11064969"")",Create a Login screen via SalesForce,,182,,,,,
"=HYPERLINK(""https://stackoverflow.com/q/11171081"", ""11171081"")",Insert Data from MySQL to Zoho Reports with the Upload Tool,,300,,,,,
"=HYPERLINK(""https://stackoverflow.com/q/11248169"", ""11248169"")",Automating Salesforce Security Checks,,509,,,,,
"=HYPERLINK(""https://stackoverflow.com/q/11306027"", ""11306027"")",Salesforce Milestone Not Reached On Approval Process Action,,348,,,,,
"=HYPERLINK(""https://stackoverflow.com/q/11316689"", ""11316689"")",Audit of what records a given user can see in SalesForce.com,,303,,,,,
"=HYPERLINK(""https://stackoverflow.com/q/11352675"", ""11352675"")",Posting Data from form (xml) to Zoho CRM with php and cURL,,1931,,,,,
"=HYPERLINK(""https://stackoverflow.com/q/11446885"", ""11446885"")",Sales force chatter trigger,,410,,,,,
"=HYPERLINK(""https://stackoverflow.com/q/11513122"", ""11513122"")",Examples of Quickbase API in C#,1.0,5412,,,,,
"=HYPERLINK(""https://stackoverflow.com/q/11698968"", ""11698968"")",Embedding client Id in chrome extension,2.0,1565,,,,,
"=HYPERLINK(""https://stackoverflow.com/q/11718933"", ""11718933"")",Retrieving the changes happened in the posts liked by user - Salesforce chatter,,114,,,,,
"=HYPERLINK(""https://stackoverflow.com/q/12004748"", ""12004748"")",Assembla Redmine JIRA Zoho Yodiz review and/or alternatives,2.0,6006,,,,,
"=HYPERLINK(""https://stackoverflow.com/q/12020334"", ""12020334"")",post to chatter from javascript,,425,,,,,
"=HYPERLINK(""https://stackoverflow.com/q/12028626"", ""12028626"")",consume salesforce chatter rest service from pure javascript,3.0,486,,,,,
"=HYPERLINK(""https://stackoverflow.com/q/12031216"", ""12031216"")","Zoho API inserRecord using Curl and XML, not returning an error and not adding the ""Potential""",,615,,,,,
"=HYPERLINK(""https://stackoverflow.com/q/12087385"", ""12087385"")",Losing tags and data when parsing XML string with Simple XML,,686,,,,,
"=HYPERLINK(""https://stackoverflow.com/q/12242168"", ""12242168"")",Lock any action on a page using JavaScript,,4303,,,,,
"=HYPERLINK(""https://stackoverflow.com/q/12270740"", ""12270740"")",Dynamic Div Height jQuery.Load() not working,,219,,,,,
"=HYPERLINK(""https://stackoverflow.com/q/12318829"", ""12318829"")",how to get zoho editor in AjaXplorer?,,874,,,,,
"=HYPERLINK(""https://stackoverflow.com/q/12382382"", ""12382382"")",CKEditor - throws 404 page not found error,,668,,,,,
"=HYPERLINK(""https://stackoverflow.com/q/12412269"", ""12412269"")","XML error Open quote is expected for attribute ""value"" when programming in PHP",,21172,General programming query [JSON to CSV/excel],,,,
"=HYPERLINK(""https://stackoverflow.com/q/12504547"", ""12504547"")",AFNetworking (400 error on POST),1.0,1298,,,,,
"=HYPERLINK(""https://stackoverflow.com/q/12507134"", ""12507134"")",Outsystems - tab issue,,1838,,,,,
"=HYPERLINK(""https://stackoverflow.com/q/12559029"", ""12559029"")",Fix up the column headers - Outsystems,,1813,,,,,
"=HYPERLINK(""https://stackoverflow.com/q/12729100"", ""12729100"")",Salesforce: Create timer on objects - is it possible?,,2181,,,,,
"=HYPERLINK(""https://stackoverflow.com/q/12892318"", ""12892318"")",CKEditor - change availabe options,,529,,,,,
"=HYPERLINK(""https://stackoverflow.com/q/13056153"", ""13056153"")",Get last record ID from QB PHP wrapper Query,,497,,,,,
"=HYPERLINK(""https://stackoverflow.com/q/13063536"", ""13063536"")",CK Editor - data loss,,206,,,,,
"=HYPERLINK(""https://stackoverflow.com/q/13085151"", ""13085151"")",Textbox default value - OutSystems,,2095,,,,,
"=HYPERLINK(""https://stackoverflow.com/q/13267422"", ""13267422"")",HTML to PDF Converter issue - Outsystems,,1600,,,,,
"=HYPERLINK(""https://stackoverflow.com/q/13393253"", ""13393253"")",Create a web service in java to receive outbound message in salesforce,,388,,,,,
"=HYPERLINK(""https://stackoverflow.com/q/13480693"", ""13480693"")",Creating a javascript validation error,,137,,,,,
"=HYPERLINK(""https://stackoverflow.com/q/13561945"", ""13561945"")","Slider for outsystems using jquery, javascript",,930,,,,,
"=HYPERLINK(""https://stackoverflow.com/q/13767870"", ""13767870"")",Apex - Salesforce.com - I need help writing an APEX class to test my working trigger - Chatter - Monitor specific keywords,,3836,,,,,
"=HYPERLINK(""https://stackoverflow.com/q/13825378"", ""13825378"")",Get XML data from Zoho Creator API,,1670,,,,,
"=HYPERLINK(""https://stackoverflow.com/q/13834716"", ""13834716"")",Rails ActionMailer configuration for Zoho,2.0,4988,,,,,
"=HYPERLINK(""https://stackoverflow.com/q/13929746"", ""13929746"")",Generate multiple PDF automatically from salesforce. Avoid getContent(),,2658,,,,,
"=HYPERLINK(""https://stackoverflow.com/q/13991036"", ""13991036"")",What is app in salesforce,,5387,,,,,
"=HYPERLINK(""https://stackoverflow.com/q/14001746"", ""14001746"")",Unable to synchronize resource src to server:ClassCastException,,776,,,,,
"=HYPERLINK(""https://stackoverflow.com/q/14281766"", ""14281766"")",Core understanding f what salesforce is,,75,,,,,
"=HYPERLINK(""https://stackoverflow.com/q/14475459"", ""14475459"")",show users list in zoho crm,,331,,,,,
"=HYPERLINK(""https://stackoverflow.com/q/14487518"", ""14487518"")",editing autofollow with salesforce chatter,,307,,,,,
"=HYPERLINK(""https://stackoverflow.com/q/14530767"", ""14530767"")",Can Lightning calendars be created with thunderbird.cfg?,,580,,,,,
"=HYPERLINK(""https://stackoverflow.com/q/14534834"", ""14534834"")",How to open a child browser window and then execute a script on the newly loaded child browser page to click a link in it,,546,,,,,
"=HYPERLINK(""https://stackoverflow.com/q/14598065"", ""14598065"")",Javascript tooltip help and color change,,2064,,,,,
"=HYPERLINK(""https://stackoverflow.com/q/14634758"", ""14634758"")",Installing Salesforce apps via code,,94,,,,,
"=HYPERLINK(""https://stackoverflow.com/q/14907056"", ""14907056"")",which value should pass to Lookup Relationship field?,,1189,,,,,
"=HYPERLINK(""https://stackoverflow.com/q/15006547"", ""15006547"")",Getting a dbid by table name,,601,,,,,
"=HYPERLINK(""https://stackoverflow.com/q/15045253"", ""15045253"")",xsd schema application to xml document?,,260,,,,,
"=HYPERLINK(""https://stackoverflow.com/q/15106856"", ""15106856"")",bryntum component integration,,194,,,,,
"=HYPERLINK(""https://stackoverflow.com/q/15224492"", ""15224492"")",Fetching data from event table in zoho crm,1.0,341,,,,,
"=HYPERLINK(""https://stackoverflow.com/q/15239231"", ""15239231"")",Company-wide chatter access through REST api,,197,,,,,
"=HYPERLINK(""https://stackoverflow.com/q/15580847"", ""15580847"")",SOQL Query not bringing back parent with no comments,,177,,,,,
"=HYPERLINK(""https://stackoverflow.com/q/15763574"", ""15763574"")",UrlFetchApp.fetch with API,,2153,,,,,
"=HYPERLINK(""https://stackoverflow.com/q/15919715"", ""15919715"")",upload a file to salesforce using connector,1.0,2644,,,,,
"=HYPERLINK(""https://stackoverflow.com/q/16001298"", ""16001298"")",Phpmailer from address failed,,8245,,,,,
"=HYPERLINK(""https://stackoverflow.com/q/16045596"", ""16045596"")",Thunderbird with lightning not reading valid ics file,,1512,,,,,
"=HYPERLINK(""https://stackoverflow.com/q/16087271"", ""16087271"")",Restsharp will not populate my class with a Zoho CRM request,,589,,,,,
"=HYPERLINK(""https://stackoverflow.com/q/16152727"", ""16152727"")",Find first occurrence of pattern in regex,,1729,,,,,
"=HYPERLINK(""https://stackoverflow.com/q/16163032"", ""16163032"")",Need a component for the Column grouping - Outsystems,,817,,,,,
"=HYPERLINK(""https://stackoverflow.com/q/16200946"", ""16200946"")",Zoho CRM lead insert via PHP,,6042,,,,,
"=HYPERLINK(""https://stackoverflow.com/q/16306006"", ""16306006"")",Using PayPal and zoho creator for credit card charge,,380,,,,,
"=HYPERLINK(""https://stackoverflow.com/q/16437979"", ""16437979"")",How to pass values from multiple selectlists in same VF containing similar list data to Apex extension using a single variable/array,,991,,,,,
"=HYPERLINK(""https://stackoverflow.com/q/16563253"", ""16563253"")",Are we able to modify the chatter digest content?,,483,,,,,
"=HYPERLINK(""https://stackoverflow.com/q/16567269"", ""16567269"")",iCalendar creation: RFC 5546 explanation,,1445,,,,,
"=HYPERLINK(""https://stackoverflow.com/q/16617053"", ""16617053"")",javascript to check string in this format,,6965,,,,,
"=HYPERLINK(""https://stackoverflow.com/q/16819801"", ""16819801"")",Rails EOFError (end of file reached) when saving a devise user,2.0,7562,,,,,
"=HYPERLINK(""https://stackoverflow.com/q/16911661"", ""16911661"")",Sync the zoho crm with sql database using c# code,,2169,,,,,
"=HYPERLINK(""https://stackoverflow.com/q/16930202"", ""16930202"")",Override standard buttons in salesforce service cloud console,,3596,,,,,
"=HYPERLINK(""https://stackoverflow.com/q/16937042"", ""16937042"")",Synchronize offline records from salesforce iPhone native app to salesforce (Using smartstore),0.0,955,,,,,
"=HYPERLINK(""https://stackoverflow.com/q/16942433"", ""16942433"")",How to Create a read-only group in SalesForce,,874,,,,,
"=HYPERLINK(""https://stackoverflow.com/q/16999224"", ""16999224"")",Make HLSL lightning effect fade out per distance,,467,,,,,
"=HYPERLINK(""https://stackoverflow.com/q/17126323"", ""17126323"")",Parsing a complex JSON result with C#,,12468,,,,,
"=HYPERLINK(""https://stackoverflow.com/q/17220341"", ""17220341"")",Automatically Login to Zoho Applications,1.0,738,,,,,
"=HYPERLINK(""https://stackoverflow.com/q/17273496"", ""17273496"")",Insert Lead in ZOHO CRM usinh PHP cURL,,2229,,,,,
"=HYPERLINK(""https://stackoverflow.com/q/17313690"", ""17313690"")",Can't Access salesforce Attachments raw/binary data in iphone,,335,,,,,
"=HYPERLINK(""https://stackoverflow.com/q/17389702"", ""17389702"")",How much Maximum Data we can store in a File in salesforce,,1058,,,,,
"=HYPERLINK(""https://stackoverflow.com/q/17575941"", ""17575941"")",How do I get a Security Token? ... Chatter Free Salesforce User - PE w/ API,,858,,,,,
"=HYPERLINK(""https://stackoverflow.com/q/17758355"", ""17758355"")","System.DmlException: Update failed. first error: INVALID_CROSS_REFERENCE_KEY,",,3444,,,,,
"=HYPERLINK(""https://stackoverflow.com/q/17801810"", ""17801810"")",Android-SalesforceSDK By Pass oAuth login,,86,,,,,
"=HYPERLINK(""https://stackoverflow.com/q/17886545"", ""17886545"")",Can't Connect to SalesForce in C#,1.0,4176,,,,,
"=HYPERLINK(""https://stackoverflow.com/q/17926933"", ""17926933"")",Error in getting salesforce attachment Blob in iOS?,,347,,,,,
"=HYPERLINK(""https://stackoverflow.com/q/17934697"", ""17934697"")",Apex - Test class adding Chatter Free users,,1640,,,,,
"=HYPERLINK(""https://stackoverflow.com/q/17958629"", ""17958629"")",How To Populate Multidimensional Array with jQuery in QuickBase,,361,,,,,
"=HYPERLINK(""https://stackoverflow.com/q/17969305"", ""17969305"")",Accessing Chatter API using JavaScript (same origin issue)?,1.0,366,,,,,
"=HYPERLINK(""https://stackoverflow.com/q/18041364"", ""18041364"")",Salesforce is not creating lead and it doesn't return Lead Id,,472,,,,,
"=HYPERLINK(""https://stackoverflow.com/q/18096689"", ""18096689"")",Zoho XML formatting issue,,1553,,,,,
"=HYPERLINK(""https://stackoverflow.com/q/18102800"", ""18102800"")",Passing data to Open CTI softphone from Salesforce,,326,,,,,
"=HYPERLINK(""https://stackoverflow.com/q/18234790"", ""18234790"")",Zoho email forwarding,2.0,1332,,,,,
"=HYPERLINK(""https://stackoverflow.com/q/18270581"", ""18270581"")","How to set quickbase permissions to add records , Edit records",,350,,,,,
"=HYPERLINK(""https://stackoverflow.com/q/18335697"", ""18335697"")",Send email through Zoho SMTP,7.0,11811,,,,,
"=HYPERLINK(""https://stackoverflow.com/q/18368258"", ""18368258"")",Error: Compile Error: Method does not exist or incorrect signature: ConnectApi.BinaryInput,,3472,,,,,
"=HYPERLINK(""https://stackoverflow.com/q/18440385"", ""18440385"")",row from datatable does not updated in salesforce,2.0,1755,,,,,
"=HYPERLINK(""https://stackoverflow.com/q/18557198"", ""18557198"")",Query to select Single Best Record based on a Column Value,,471,,,,,
"=HYPERLINK(""https://stackoverflow.com/q/18580277"", ""18580277"")",Chatter Moderator User Security Token,,155,,,,,
"=HYPERLINK(""https://stackoverflow.com/q/18617586"", ""18617586"")",Where to store XML or PHP file when linking Zoho CRM to Kashflow,,240,,,,,
"=HYPERLINK(""https://stackoverflow.com/q/18624062"", ""18624062"")",Using JavaScript for form confirmation message (with Zoho contact form),,576,,,,,
"=HYPERLINK(""https://stackoverflow.com/q/18730532"", ""18730532"")",Unable to parse datatype error when sending a Curl POSted XML,,833,,,,,
