Id,Title,FavoriteCount,ViewCount,tag1,Tag2,Tag3,Tag4,isProblematic
"=HYPERLINK(""https://stackoverflow.com/q/44931104"", ""44931104"")",Salesforce OpenCTI API for lightning could not be initialized,,832,,,,,
"=HYPERLINK(""https://stackoverflow.com/q/44950507"", ""44950507"")",Zoho Creator - Retrieving the actual text value of a Form's Lookup Dropdown field,,1268,,,,,
"=HYPERLINK(""https://stackoverflow.com/q/44952033"", ""44952033"")",window.scrollTo() not working,,466,,,,,
"=HYPERLINK(""https://stackoverflow.com/q/44956629"", ""44956629"")",Is it possible to use PostgreSQL with Google AppMaker?,,527,,,,,
"=HYPERLINK(""https://stackoverflow.com/q/44963674"", ""44963674"")",PowerApps :- Failed to load resource,,284,,,,,
"=HYPERLINK(""https://stackoverflow.com/q/44974408"", ""44974408"")",How to generate totals of fields from related model records,1.0,803,,,,,
"=HYPERLINK(""https://stackoverflow.com/q/44980903"", ""44980903"")",Using existing Cloud SQL Table loads slow; Creating Table through AppMaker in Cloud SQL loads fast,,251,,,,,
"=HYPERLINK(""https://stackoverflow.com/q/45004378"", ""45004378"")",Presenting relational data as columns in table,,285,,,,,
"=HYPERLINK(""https://stackoverflow.com/q/45019323"", ""45019323"")",Are Media Queries Supported?,,85,,,,,
"=HYPERLINK(""https://stackoverflow.com/q/45045407"", ""45045407"")",I receive an error that a record is in use when using a checkbox widget,,30,,,,,
"=HYPERLINK(""https://stackoverflow.com/q/45045520"", ""45045520"")",How to view log of user actions,,102,,,,,
"=HYPERLINK(""https://stackoverflow.com/q/45068055"", ""45068055"")",Google App Maker - Emailing a completed form,,423,,,,,
"=HYPERLINK(""https://stackoverflow.com/q/45091910"", ""45091910"")",Cannot create new item in manual save mode database,,297,,,,,
"=HYPERLINK(""https://stackoverflow.com/q/45101901"", ""45101901"")",Google App Maker console,,320,,,,,
"=HYPERLINK(""https://stackoverflow.com/q/45120914"", ""45120914"")",Field enabled based on role,,257,,,,,
"=HYPERLINK(""https://stackoverflow.com/q/45133010"", ""45133010"")",How to make an element fixed on the viewport?,,310,,,,,
"=HYPERLINK(""https://stackoverflow.com/q/45145338"", ""45145338"")",Can I use Master Data Services to import data via Excel add-in ? Mainly Measures! (Numbers/Values),,730,,,,,
"=HYPERLINK(""https://stackoverflow.com/q/45171327"", ""45171327"")",Displaying form on first login,,93,,,,,
"=HYPERLINK(""https://stackoverflow.com/q/45174597"", ""45174597"")",Zoho Reports API - Error Code 7005,,164,,,,,
"=HYPERLINK(""https://stackoverflow.com/q/45177765"", ""45177765"")",Table Not Updating After Adding Entry,,645,,,,,
"=HYPERLINK(""https://stackoverflow.com/q/45195523"", ""45195523"")",App Maker: Public facing IP for UrlFetch?,,485,,,,,
"=HYPERLINK(""https://stackoverflow.com/q/45197195"", ""45197195"")",Use multiple App Maker fragment forms on the same page,1.0,393,,,,,
"=HYPERLINK(""https://stackoverflow.com/q/45202450"", ""45202450"")",get leads information from Zoho crm using api,,408,,,,,
"=HYPERLINK(""https://stackoverflow.com/q/45209796"", ""45209796"")",Do I have the latest version of an OutSystems forge component?,,114,Maintenance,,,,
"=HYPERLINK(""https://stackoverflow.com/q/45224565"", ""45224565"")",Trying To Send Creation Notification Email,,362,,,,,
"=HYPERLINK(""https://stackoverflow.com/q/45232971"", ""45232971"")",Cannot add new correlated record to new created record,,577,,,,,
"=HYPERLINK(""https://stackoverflow.com/q/45238254"", ""45238254"")",Having some trouble with getting an automatic import of a Sheet into a Data Table,,102,,,,,
"=HYPERLINK(""https://stackoverflow.com/q/45245708"", ""45245708"")",How to toggle a panel's visibility,,654,,,,,
"=HYPERLINK(""https://stackoverflow.com/q/45273016"", ""45273016"")",How to create dynamic form in google app maker?,,507,,,,,
"=HYPERLINK(""https://stackoverflow.com/q/45281799"", ""45281799"")",How can I reduce the file size of my forge extension (.xif)?,,70,,,,,
"=HYPERLINK(""https://stackoverflow.com/q/45288895"", ""45288895"")",Table Not Updating With Manual Save Mode,,702,,,,,
"=HYPERLINK(""https://stackoverflow.com/q/45310175"", ""45310175"")",creating a link to the record in a completed form,,709,,,,,
"=HYPERLINK(""https://stackoverflow.com/q/45310234"", ""45310234"")",Size limit on ContentVersion object in Salesforce,,2355,,,,,
"=HYPERLINK(""https://stackoverflow.com/q/45312549"", ""45312549"")",Error With Email Change Notifications Using Project Tracker Template,,112,,,,,
"=HYPERLINK(""https://stackoverflow.com/q/45318013"", ""45318013"")",Using Microsoft Common data services SDK in asp.net web api,,429,,,,,
"=HYPERLINK(""https://stackoverflow.com/q/45324416"", ""45324416"")","ZOHO smtp SMTPAuthenticationError at / (535, 'Authentication Failed') Django app",2.0,1110,,,,,
"=HYPERLINK(""https://stackoverflow.com/q/45324749"", ""45324749"")","How to create a (CSS) style variant for a dropdown widget, to target its list rows with it?",0.0,176,,,,,
"=HYPERLINK(""https://stackoverflow.com/q/45334821"", ""45334821"")",Embedded map in Google App Maker not rendering in Chrome browser,,163,,,,,
"=HYPERLINK(""https://stackoverflow.com/q/45336337"", ""45336337"")",Trying To Include Email Address (or User's Name) In Notification Email,,708,,,,,
"=HYPERLINK(""https://stackoverflow.com/q/45363366"", ""45363366"")",Want To Copy Certain Fields From Previous Entry To New Fragment,,209,,,,,
"=HYPERLINK(""https://stackoverflow.com/q/45380713"", ""45380713"")","Microsoft Flow - How to run an activity ""When a record is created"", until manually stop/more than 30 days",,72,,,,,
"=HYPERLINK(""https://stackoverflow.com/q/45418662"", ""45418662"")",Possible to have radio buttons not required?,,408,,,,,
"=HYPERLINK(""https://stackoverflow.com/q/45425713"", ""45425713"")",No Longer Able to Access App Maker,,681,,,,,
"=HYPERLINK(""https://stackoverflow.com/q/45442784"", ""45442784"")",Submit Form POST using VB .NET,,3880,,,,,
"=HYPERLINK(""https://stackoverflow.com/q/45470211"", ""45470211"")",Client unable to access shared SQL Server (on-Premise) connection,,424,,,,,
"=HYPERLINK(""https://stackoverflow.com/q/45473657"", ""45473657"")",How can I constrain Vinyl / Composite Records?,,111,,,,,
"=HYPERLINK(""https://stackoverflow.com/q/45480663"", ""45480663"")",Publishing a public app,,381,,,,,
"=HYPERLINK(""https://stackoverflow.com/q/45483554"", ""45483554"")",Powerapps Filter records in browse gallery based on value in dropdown,,5048,,,,,
"=HYPERLINK(""https://stackoverflow.com/q/45494320"", ""45494320"")",Trying To Put Current User Name Into Notification Email,,443,,,,,
"=HYPERLINK(""https://stackoverflow.com/q/45507738"", ""45507738"")",Rails Zoho Net::SMTPAuthenticationError: 530,,347,,,,,
"=HYPERLINK(""https://stackoverflow.com/q/45511290"", ""45511290"")",Can Microsoft PowerApps create public facing apps,,2234,,,,,
"=HYPERLINK(""https://stackoverflow.com/q/45513359"", ""45513359"")","Error With ""null"" Field In Email Notification Script",,226,,,,,
"=HYPERLINK(""https://stackoverflow.com/q/45535094"", ""45535094"")",Cannot use Javamail with Zoho,,211,,,,,
"=HYPERLINK(""https://stackoverflow.com/q/45545220"", ""45545220"")",Appmaker with BigQuery (Read/Write/Update/Delete),,500,,,,,
"=HYPERLINK(""https://stackoverflow.com/q/45555483"", ""45555483"")",Recording Phone Number and Full Name in Project Datasource,,110,,,,,
"=HYPERLINK(""https://stackoverflow.com/q/45555969"", ""45555969"")",Unable to publish to a new deployment,,69,Deployment Issues [ Local Development],,,,
"=HYPERLINK(""https://stackoverflow.com/q/45556919"", ""45556919"")",Date.toLocaleTimeString does not show the proper time. It is 4 hours difference from the current time. Why?,,1048,,,,,
"=HYPERLINK(""https://stackoverflow.com/q/45563892"", ""45563892"")",How to parsing Json in Zoho CRM,1.0,126,,,,,
"=HYPERLINK(""https://stackoverflow.com/q/45565228"", ""45565228"")",how to dynamically highlight a data point in line chart,,356,,,,,
"=HYPERLINK(""https://stackoverflow.com/q/45572394"", ""45572394"")",Google App Maker using dropdowns as filters with a table widget drilling down into the results,,808,,,,,
"=HYPERLINK(""https://stackoverflow.com/q/45588139"", ""45588139"")",Using Microsoft Flow to send notification to powerapps,,542,,,,,
"=HYPERLINK(""https://stackoverflow.com/q/45602479"", ""45602479"")",Linking PDFs (files) To Entries,,148,,,,,
"=HYPERLINK(""https://stackoverflow.com/q/45662481"", ""45662481"")",In Powerapps how to filter the gallery including an All option?,,1295,,,,,
"=HYPERLINK(""https://stackoverflow.com/q/45672938"", ""45672938"")",pass information and display in label control in another screen in power apps,,1291,,,,,
"=HYPERLINK(""https://stackoverflow.com/q/45678498"", ""45678498"")",Drive picker upload to a team drive as opposed to personal google drive,,389,,,,,
"=HYPERLINK(""https://stackoverflow.com/q/45686397"", ""45686397"")",How to I revert to manual save mode,,266,,,,,
"=HYPERLINK(""https://stackoverflow.com/q/45688074"", ""45688074"")",Powerapps - get stuck with UpdateContext,1.0,1070,,,,,
"=HYPERLINK(""https://stackoverflow.com/q/45693510"", ""45693510"")",Outlook 'Flow' AppBuilder issues - Branching Condition Not Satisfied,,1178,,,,,
"=HYPERLINK(""https://stackoverflow.com/q/45697947"", ""45697947"")",Cannot query records on models with changes error message,,437,,,,,
"=HYPERLINK(""https://stackoverflow.com/q/45699468"", ""45699468"")","I have a table with records. No matter which View button I click, the bottom record is displayed",,58,,,,,
"=HYPERLINK(""https://stackoverflow.com/q/45709701"", ""45709701"")",Deleting data from Drive Tables and automatically re-importing new data,,320,,,,,
"=HYPERLINK(""https://stackoverflow.com/q/45711200"", ""45711200"")",Customization of BrowserGallery in PowerApps,,147,,,,,
"=HYPERLINK(""https://stackoverflow.com/q/45722513"", ""45722513"")",How to create new records from the server script,,1025,,,,,
"=HYPERLINK(""https://stackoverflow.com/q/45723760"", ""45723760"")",How do perform logging or debug output in a server script?,,464,Debugging Error/crash [why this does not work| Application Code change not executed| Broken UI| Functionalities not working| boken UI| Embedding | ],,,,
"=HYPERLINK(""https://stackoverflow.com/q/45724820"", ""45724820"")",Powerapps import unsuccesfull,,171,,,,,
"=HYPERLINK(""https://stackoverflow.com/q/45731288"", ""45731288"")",How to access views in powerapps,,1421,,,,,
"=HYPERLINK(""https://stackoverflow.com/q/45740520"", ""45740520"")",appmaker data: connect to multiple Cloud SQL databases,1.0,515,,,,,
"=HYPERLINK(""https://stackoverflow.com/q/45748997"", ""45748997"")",Excel/Sheets copy-compatible table widget,,165,,,,,
"=HYPERLINK(""https://stackoverflow.com/q/45751896"", ""45751896"")",Can Salesforce Commerce Cloud be used as CMS?,,688,,,,,
"=HYPERLINK(""https://stackoverflow.com/q/45766911"", ""45766911"")",Is it possible to implement custom transformers?,,87,,,,,
"=HYPERLINK(""https://stackoverflow.com/q/45767036"", ""45767036"")",How to apply transformers and/or binding expressions to the data in a table?,,575,,,,,
"=HYPERLINK(""https://stackoverflow.com/q/45772221"", ""45772221"")",Nodemailer with ZOHO mail,,4496,,,,,
"=HYPERLINK(""https://stackoverflow.com/q/45802802"", ""45802802"")",Setting PowerApps CustomConnector to OAuth2/AzureAD,,704,,,,,
"=HYPERLINK(""https://stackoverflow.com/q/45805113"", ""45805113"")",Completely lost when it comes to using the DrivePicker widget,,276,,,,,
"=HYPERLINK(""https://stackoverflow.com/q/45817120"", ""45817120"")",Sharepoint / Intranet access to database,,166,,,,,
"=HYPERLINK(""https://stackoverflow.com/q/45822590"", ""45822590"")",Get custom fields from the directoy,,228,,,,,
"=HYPERLINK(""https://stackoverflow.com/q/45824743"", ""45824743"")","Zoho Bill ""tax_type"" field on REST endpoint",,52,,,,,
"=HYPERLINK(""https://stackoverflow.com/q/45827341"", ""45827341"")",Insert form shifts to the left after running the AMU.loadRecordByKey function,,57,,,,,
"=HYPERLINK(""https://stackoverflow.com/q/45830273"", ""45830273"")",Google Appmaker selectedRow,1.0,1134,,,,,
"=HYPERLINK(""https://stackoverflow.com/q/45834435"", ""45834435"")",<ui:inputText> keyup returns incorrect value (one less),1.0,3370,Tutorial [How to do this ],,,,
"=HYPERLINK(""https://stackoverflow.com/q/45842944"", ""45842944"")",Images as buttons google app maker,,249,,,,,
"=HYPERLINK(""https://stackoverflow.com/q/45846521"", ""45846521"")",Unable to send mail using zoho smtp server,,589,,,,,
"=HYPERLINK(""https://stackoverflow.com/q/45853491"", ""45853491"")",ZOHO CRM - How to find and merge all the duplicate records in bulk?,,123,,,,,
"=HYPERLINK(""https://stackoverflow.com/q/45874369"", ""45874369"")",unable to parse xml data when description is large,,27,,,,,
"=HYPERLINK(""https://stackoverflow.com/q/45875383"", ""45875383"")",How to access page fragment custom properties programmatically?,,867,,,,,
"=HYPERLINK(""https://stackoverflow.com/q/45896488"", ""45896488"")","python 2 code VS python 3 ,zoho crm api",,112,,,,,
"=HYPERLINK(""https://stackoverflow.com/q/45901296"", ""45901296"")","How to express ""or"" in a model Query?",,459,,,,,
"=HYPERLINK(""https://stackoverflow.com/q/45909358"", ""45909358"")",How to create a rest api in app maker?,1.0,1166,,,,,
"=HYPERLINK(""https://stackoverflow.com/q/45921253"", ""45921253"")",Have an extra required error validation I can't figure out where it comes from...can't submit,,56,,,,,
"=HYPERLINK(""https://stackoverflow.com/q/45928071"", ""45928071"")",Open Activities - New Event - Zoho CRM API,,253,,,,,
"=HYPERLINK(""https://stackoverflow.com/q/45931378"", ""45931378"")",Cannot validate on saving new record,,115,,,,,
"=HYPERLINK(""https://stackoverflow.com/q/45933300"", ""45933300"")",How to connect PowerApps with AzureAD,,3160,,,,,
"=HYPERLINK(""https://stackoverflow.com/q/45941854"", ""45941854"")",Google App maker debugging,,1206,,,,,
"=HYPERLINK(""https://stackoverflow.com/q/45949757"", ""45949757"")",How to integrate Zoho Crm with twilio using Php,,137,,,,,
"=HYPERLINK(""https://stackoverflow.com/q/45954124"", ""45954124"")",Google App Maker how to save and update records?,,1920,,,,,
"=HYPERLINK(""https://stackoverflow.com/q/45955538"", ""45955538"")",Workaround for CSS variables in IE?,8.0,36486,General programming query [JSON to CSV/excel],,,,
"=HYPERLINK(""https://stackoverflow.com/q/45963371"", ""45963371"")",Google App maker Drive picker,,655,,,,,
"=HYPERLINK(""https://stackoverflow.com/q/45967361"", ""45967361"")",Leaflet Map in Lightning component on account page,,1277,,,,,
"=HYPERLINK(""https://stackoverflow.com/q/45975826"", ""45975826"")",Google App maker grouping in list view,,85,,,,,
"=HYPERLINK(""https://stackoverflow.com/q/45978094"", ""45978094"")",Google App maker drive picker attachments,,295,,,,,
"=HYPERLINK(""https://stackoverflow.com/q/45980951"", ""45980951"")",Google App Maker how to apply custom data validation,1.0,1099,,,,,
"=HYPERLINK(""https://stackoverflow.com/q/45993730"", ""45993730"")",Send mail with zoho smtp server in codeigniter from Google app engine,,610,,,,,
"=HYPERLINK(""https://stackoverflow.com/q/45996851"", ""45996851"")",Google app maker Side bar or menu bar,,836,,,,,
"=HYPERLINK(""https://stackoverflow.com/q/46001148"", ""46001148"")",Google App maker list view filtering,,2140,,,,,
"=HYPERLINK(""https://stackoverflow.com/q/46016491"", ""46016491"")",Validate visual flow screen fields using 3rd part javascript library,,78,,,,,
"=HYPERLINK(""https://stackoverflow.com/q/46016758"", ""46016758"")",Google App maker List view grouping,,370,,,,,
"=HYPERLINK(""https://stackoverflow.com/q/46038130"", ""46038130"")",Event Listener for App Maker Text Editor Widget,,325,,,,,
"=HYPERLINK(""https://stackoverflow.com/q/46041253"", ""46041253"")",Saving to specific folder with Drive Picker,,159,,,,,
"=HYPERLINK(""https://stackoverflow.com/q/46057517"", ""46057517"")",Google App maker user picker validation,,818,,,,,
"=HYPERLINK(""https://stackoverflow.com/q/46058660"", ""46058660"")",Validate Structure Mandatory Attributes in OutSystems,,437,,,,,
"=HYPERLINK(""https://stackoverflow.com/q/46058884"", ""46058884"")",How do I just reference the Body field in a record?,,49,,,,,
"=HYPERLINK(""https://stackoverflow.com/q/46060441"", ""46060441"")",Google app maker Loading image,,228,,,,,
"=HYPERLINK(""https://stackoverflow.com/q/46061585"", ""46061585"")",Get a Google App Make application open to not only a specific page but also a specific record?,1.0,339,,,,,
"=HYPERLINK(""https://stackoverflow.com/q/46065546"", ""46065546"")",Error: Lookups on activites must have a unique domain,,1944,,,,,
"=HYPERLINK(""https://stackoverflow.com/q/46067509"", ""46067509"")",Google App maker record key value,,781,General programming query [JSON to CSV/excel],,,,
"=HYPERLINK(""https://stackoverflow.com/q/46067552"", ""46067552"")",How to Identify Elements in Salesforce Lightning for Selenium,,2032,General programming query [JSON to CSV/excel],,,,
"=HYPERLINK(""https://stackoverflow.com/q/46077840"", ""46077840"")",Google App maker multiple transformers,,190,Data binding,,,,
"=HYPERLINK(""https://stackoverflow.com/q/46088465"", ""46088465"")",Google Appmaker: Update form based on selected dropdown option,2.0,1813,Application Customization [QR code | Automatic value| Show/Hide Component| Pagination],,,,
"=HYPERLINK(""https://stackoverflow.com/q/46090082"", ""46090082"")",Refresh UI component on DB update,1.0,232,Tutorial [How to do this ],,,,
"=HYPERLINK(""https://stackoverflow.com/q/46124156"", ""46124156"")","""Drive Table internal error. Request is too large"" as loading data into an app maker deployment",,70,Debugging Error/crash [why this does not work| Application Code change not executed| Broken UI| Functionalities not working| boken UI| ],,,,
"=HYPERLINK(""https://stackoverflow.com/q/46144718"", ""46144718"")",Google App maker date filtering,,479,Application Customization [QR code | Automatic value| Show/Hide Component| Pagination],,,,
"=HYPERLINK(""https://stackoverflow.com/q/46158698"", ""46158698"")",Google App maker dropdown null item name,,522,Debugging Error/crash [why this does not work| Application Code change not executed| Broken UI| Functionalities not working| boken UI| ],,,,
"=HYPERLINK(""https://stackoverflow.com/q/46171283"", ""46171283"")",nodemailer and zoho email issue '530 Must issue a STARTTLS command first.',1.0,1793,Email configuration [SMTP Authentication],,,,
"=HYPERLINK(""https://stackoverflow.com/q/46193704"", ""46193704"")",Using JSignature to return strokes,,185,Tutorial [How to do this ],,,,
"=HYPERLINK(""https://stackoverflow.com/q/46195839"", ""46195839"")",Google App Maker driver picker files,,498,Queries on Platform [plaform comparision | platform features],,,,
"=HYPERLINK(""https://stackoverflow.com/q/46206200"", ""46206200"")",Move record from one data model to another with a button,,88,UI customization [Design flexibility|  UI Overflow| Show/Hide Component|],,,,
"=HYPERLINK(""https://stackoverflow.com/q/46206207"", ""46206207"")",How to setup people viewer,,73,Tutorial [How to do this ],,,,
"=HYPERLINK(""https://stackoverflow.com/q/46211514"", ""46211514"")",Integrating Cordova plugin in Outsystems,,791,Debugging Error/crash [why this does not work| Application Code change not executed| Broken UI| Functionalities not working| boken UI| ],,,,
"=HYPERLINK(""https://stackoverflow.com/q/46226398"", ""46226398"")",Pulling date data with onclick var,,213,Debugging Error/crash [why this does not work| Application Code change not executed| Broken UI| Functionalities not working| boken UI| ],,,,
"=HYPERLINK(""https://stackoverflow.com/q/46227182"", ""46227182"")",Deleting all entered data in a datastore in AppMaker,,714,Database CRUD [Complex Database query| DB query for M:M data model| DB query unexpected| ],,,,
"=HYPERLINK(""https://stackoverflow.com/q/46236405"", ""46236405"")",Performance server scripting,,162,General programming query [JSON to CSV/excel],,,,
"=HYPERLINK(""https://stackoverflow.com/q/46238759"", ""46238759"")",Convert Postman call into normal API call,,296,General query [HTTP error header message  explanation | Feature usage query | Learning curve],,,,
"=HYPERLINK(""https://stackoverflow.com/q/46241015"", ""46241015"")",How to create a record on Zoho CRM through API (insertRecords method),,461,Documentation [incorrent| incomplete| ambiguous| Ambiguous sample code integration],,,,
"=HYPERLINK(""https://stackoverflow.com/q/46250017"", ""46250017"")",Login to PowerApps using Sharepoint Credentials,,1292,General query [HTTP error header message  explanation | Feature usage query | Learning curve],,,,
"=HYPERLINK(""https://stackoverflow.com/q/46257017"", ""46257017"")",How to do logic based on radio button in Google App Maker,,400,Application Customization [QR code | Automatic value| Show/Hide Component| Pagination],,,,
"=HYPERLINK(""https://stackoverflow.com/q/46271988"", ""46271988"")",Getting error for import data from sheet in appmaker,,102,Debugging Error/crash [why this does not work| Application Code change not executed| Broken UI| Functionalities not working| boken UI| ],,,,
"=HYPERLINK(""https://stackoverflow.com/q/46275169"", ""46275169"")",UserPicker changes not registered,,123,Debugging Error/crash [why this does not work| Application Code change not executed| Broken UI| Functionalities not working| boken UI| ]d,,,,
"=HYPERLINK(""https://stackoverflow.com/q/46277360"", ""46277360"")",Can I set up a web form that will populate an opportunity in my salesforce,,543,Tutorial [How to do this ],,,,
"=HYPERLINK(""https://stackoverflow.com/q/46289453"", ""46289453"")",I am trying to create my first power apps application with 2 sql server connected tables,,183,Database CRUD [Complex Database query| DB query for M:M data model| DB query unexpected| ],,,,
"=HYPERLINK(""https://stackoverflow.com/q/46295367"", ""46295367"")",Google App maker drive picker folders,1.0,468,UI customization [Design flexibility|  UI Overflow| Show/Hide Component|],,,,
"=HYPERLINK(""https://stackoverflow.com/q/46297894"", ""46297894"")",Google App maker mobile and browser compatibility,,642,Browser compatibility,,,,
"=HYPERLINK(""https://stackoverflow.com/q/46303370"", ""46303370"")",How to use if condition in powerapp for populating dropdown which depends on selection of a control,,2706,Application Customization [QR code | Automatic value| Show/Hide Component| Pagination],,,,
"=HYPERLINK(""https://stackoverflow.com/q/46314967"", ""46314967"")",Powerapps : how to use submit button to store values of form controls into excel online,,1805,Tutorial [How to do this ],,,,
"=HYPERLINK(""https://stackoverflow.com/q/46321865"", ""46321865"")",Google App maker User picker,,783,UI customization [Design flexibility|  UI Overflow| Show/Hide Component|],,,,
"=HYPERLINK(""https://stackoverflow.com/q/46330301"", ""46330301"")",How to extra data from the app or file using google appmaker,,174,Queries on Platform [plaform comparision | platform features],,,,
"=HYPERLINK(""https://stackoverflow.com/q/46336305"", ""46336305"")",Create/authenticate a connector on a button click?,,90,Session/Authentication [social auth | oaut2 | jtoken],,,,
"=HYPERLINK(""https://stackoverflow.com/q/46340789"", ""46340789"")",The custom connector property 'capabilities' cannot be updated - PowerApps,1.0,79,Debugging Error/crash [why this does not work| Application Code change not executed| Broken UI| Functionalities not working| boken UI| ],,,,
"=HYPERLINK(""https://stackoverflow.com/q/46342043"", ""46342043"")",Google App maker Drive files collaboration,1.0,439,,,,,
"=HYPERLINK(""https://stackoverflow.com/q/46348449"", ""46348449"")",Issues with losing all documents when going to deployment url,,64,Deployment Issues [ Local Development],,,,
"=HYPERLINK(""https://stackoverflow.com/q/46362311"", ""46362311"")","How to handle special character (e.g : '&', '-' etc) in zoho api searchRecords?",,462,General programming query [JSON to CSV/excel],,,,
"=HYPERLINK(""https://stackoverflow.com/q/46369742"", ""46369742"")",Losing data after deployment - clarification,,46,Application accessibility,,,,
"=HYPERLINK(""https://stackoverflow.com/q/46378576"", ""46378576"")",Connect server script to page to add new data to spreadsheet,,102,General query [HTTP error header message  explanation | Feature usage query | Learning curve],,,,
"=HYPERLINK(""https://stackoverflow.com/q/46382002"", ""46382002"")","Is there a way to close the browser using googlescript or javascript, by just clicking a button for it?",,105,Tutorial [How to do this ],,,,
"=HYPERLINK(""https://stackoverflow.com/q/46387200"", ""46387200"")",How to pass a value from one page to another with onclick event in AppMaker,,532,Application Customization [QR code | Automatic value| Show/Hide Component| Pagination],,,,
"=HYPERLINK(""https://stackoverflow.com/q/46417978"", ""46417978"")","Zoho API file upload error ""Unable to process your request. Please verify whether you have provided proper file.""",,387,Debugging Error/crash [why this does not work| Application Code change not executed| Broken UI| Functionalities not working| boken UI| ],,,,
"=HYPERLINK(""https://stackoverflow.com/q/46421271"", ""46421271"")",Using Salesforce Data Import Wizard to Import Contacts and Convert Leads,,982,Database [connection| sclability| model design| Export/import data| Database design| DB scalability| DB Admin Authorization|,,,,
"=HYPERLINK(""https://stackoverflow.com/q/46422037"", ""46422037"")",Microsoft Powerapps - How to connect to different datasource in one form,,1803,Data binding,,,,
