Id,Title,FavoriteCount,ViewCount,tag1,Tag2,Tag3,Tag4,isProblematic
"=HYPERLINK(""https://stackoverflow.com/q/57620833"", ""57620833"")",Recursion problem reading a file from salesforce aura helper,,68,,,,,
"=HYPERLINK(""https://stackoverflow.com/q/57623152"", ""57623152"")",Console.log() it's not showing the result of a function,,88,,,,,
"=HYPERLINK(""https://stackoverflow.com/q/57624459"", ""57624459"")",Create record to another table on Google App Maker,,57,,,,,
"=HYPERLINK(""https://stackoverflow.com/q/57626023"", ""57626023"")",Salesforce Lightning Auto-Populated ID's (Parent to Child),,10,,,,,
"=HYPERLINK(""https://stackoverflow.com/q/57647663"", ""57647663"")",While preview file I need to remove 'Show More' option in Lightning,,85,,,,,
"=HYPERLINK(""https://stackoverflow.com/q/57652832"", ""57652832"")",How can I modify the meta data of any field using apex,,45,,,,,
"=HYPERLINK(""https://stackoverflow.com/q/57654496"", ""57654496"")",Repeating Salesforce Workflow actions every x days,,53,,,,,
"=HYPERLINK(""https://stackoverflow.com/q/57657610"", ""57657610"")",How to get the image of the reports & dashboard in salesforce using API?,,28,,,,,
"=HYPERLINK(""https://stackoverflow.com/q/57676928"", ""57676928"")",How to debug multiple modules at the same time in OutSystems,,83,,,,,
"=HYPERLINK(""https://stackoverflow.com/q/57677076"", ""57677076"")",How to make pop-up data reflect selected record?,1.0,82,,,,,
"=HYPERLINK(""https://stackoverflow.com/q/57685832"", ""57685832"")",CPQ quote line showing multi-time,,15,,,,,
"=HYPERLINK(""https://stackoverflow.com/q/57686877"", ""57686877"")",I have a problem with Zoho Integration (JS SDK),,173,,,,,
"=HYPERLINK(""https://stackoverflow.com/q/57687014"", ""57687014"")",Network.getNetworkId() returning Null in test class,,191,,,,,
"=HYPERLINK(""https://stackoverflow.com/q/57710817"", ""57710817"")","AppMaker Error: ""SEVERE: Failed due to circular reference."" when I try to run server script for ""query.sorting"" a table",,100,,,,,
"=HYPERLINK(""https://stackoverflow.com/q/57711779"", ""57711779"")",Spaces under Flexible Height Gallery Rows,,212,,,,,
"=HYPERLINK(""https://stackoverflow.com/q/57713713"", ""57713713"")",How do I filter choices from a lookup field that points to a different SharePoint list?,,46,,,,,
"=HYPERLINK(""https://stackoverflow.com/q/57714229"", ""57714229"")",Any way to find out the fields in a datasource?,,53,,,,,
"=HYPERLINK(""https://stackoverflow.com/q/57731105"", ""57731105"")","Powerapps, take photo and send it to other screen",,106,,,,,
"=HYPERLINK(""https://stackoverflow.com/q/57750105"", ""57750105"")",Dropdowns populated from Excel tables not getting selected properly,,73,,,,,
"=HYPERLINK(""https://stackoverflow.com/q/57754071"", ""57754071"")",export data with relations in excel,,58,,,,,
"=HYPERLINK(""https://stackoverflow.com/q/57755093"", ""57755093"")",Uncaught (in promise) TypeError: c.createElement is not a function,,218,,,,,
"=HYPERLINK(""https://stackoverflow.com/q/57762017"", ""57762017"")",Fetch data from ZOHO CREATOR API with python using requests library,1.0,266,,,,,
"=HYPERLINK(""https://stackoverflow.com/q/57775247"", ""57775247"")",How can I see a Dynamics365 table?,,250,,,,,
"=HYPERLINK(""https://stackoverflow.com/q/57775673"", ""57775673"")",How to read and structured data from an Excel and add into a pie chart in PowerApps?,,23,,,,,
"=HYPERLINK(""https://stackoverflow.com/q/57787836"", ""57787836"")",Questions on how to handle creating new items while offline (Common Data Service),1.0,26,,,,,
"=HYPERLINK(""https://stackoverflow.com/q/57794087"", ""57794087"")",Searching a Sharepoint list from a Powerapp is working for one column but not another,,104,,,,,
"=HYPERLINK(""https://stackoverflow.com/q/57794437"", ""57794437"")",How to collect data from a form and inset it in another sharepoint list,,41,,,,,
"=HYPERLINK(""https://stackoverflow.com/q/57795677"", ""57795677"")",Overriding the redirect on saving force:createRecord on Salesforce Lightning,,534,,,,,
"=HYPERLINK(""https://stackoverflow.com/q/57795979"", ""57795979"")","Using a DatePicker as a parameter in datasource script builder,",,19,,,,,
"=HYPERLINK(""https://stackoverflow.com/q/57802832"", ""57802832"")",InternalError: Cannot convert Array to number[][] - Error in App Maker,,1321,,,,,
"=HYPERLINK(""https://stackoverflow.com/q/57806521"", ""57806521"")",What is the similarity between outsystem and Red hat fuse?,,45,,,,,
"=HYPERLINK(""https://stackoverflow.com/q/57810467"", ""57810467"")",How to get User Email who is submitting the form and save it,1.0,34,,,,,
"=HYPERLINK(""https://stackoverflow.com/q/57810829"", ""57810829"")",Query Script Datasource not updating on change,,37,,,,,
"=HYPERLINK(""https://stackoverflow.com/q/57811097"", ""57811097"")",Powerapp filter by user's office location,,48,,,,,
"=HYPERLINK(""https://stackoverflow.com/q/57814318"", ""57814318"")",Customize ForgotPasswordInterstitial page in Salesforce,,60,,,,,
"=HYPERLINK(""https://stackoverflow.com/q/57820524"", ""57820524"")","How to fix the connection error between Google App Maker and Cloud SQL: ""Communications link failure""?",,69,,,,,
"=HYPERLINK(""https://stackoverflow.com/q/57825022"", ""57825022"")",I can only see Tree View and not Screens View. Why is this so?,,31,,,,,
"=HYPERLINK(""https://stackoverflow.com/q/57825080"", ""57825080"")","Records and multithreading, converting to pass through the wall",,23,,,,,
"=HYPERLINK(""https://stackoverflow.com/q/57827537"", ""57827537"")",How can I change the icon of the checkbox widget?,,38,,,,,
"=HYPERLINK(""https://stackoverflow.com/q/57828966"", ""57828966"")",Validate Stored Procedure Success in Powerapps,2.0,137,,,,,
"=HYPERLINK(""https://stackoverflow.com/q/57831723"", ""57831723"")",In Zoho Creator unable to pass the decision from Zoho Workflow (deluge script) to Zoho Form,,176,,,,,
"=HYPERLINK(""https://stackoverflow.com/q/57832672"", ""57832672"")",Distinguish between Preview/Publish or get Database Name,,20,,,,,
"=HYPERLINK(""https://stackoverflow.com/q/57833839"", ""57833839"")",How to force load and item by key in form?,,27,,,,,
"=HYPERLINK(""https://stackoverflow.com/q/57836593"", ""57836593"")",Opportunity Validation Rule on Closed Won Opportunities,,108,,,,,
"=HYPERLINK(""https://stackoverflow.com/q/57848501"", ""57848501"")",Connection String test failed: Outsystems,,82,,,,,
"=HYPERLINK(""https://stackoverflow.com/q/57849964"", ""57849964"")",Why the AudioUnit collect 940bytes per frame under the earphone with lightning plug,,20,,,,,
"=HYPERLINK(""https://stackoverflow.com/q/57850922"", ""57850922"")",Connecting to third party API (basic auth),,29,,,,,
"=HYPERLINK(""https://stackoverflow.com/q/57858132"", ""57858132"")",Creating a formula field,,29,,,,,
"=HYPERLINK(""https://stackoverflow.com/q/57859250"", ""57859250"")","How to generate Kanban with lists based on relationship between Item A, Item B and yet another sub-relationship with Item A?",,58,,,,,
"=HYPERLINK(""https://stackoverflow.com/q/57861623"", ""57861623"")",What is the proper to handle relations in a popup when _fk item is depreciated,,33,,,,,
"=HYPERLINK(""https://stackoverflow.com/q/57864148"", ""57864148"")",Getting exception while try to do a ajax call,,36,,,,,
"=HYPERLINK(""https://stackoverflow.com/q/57867919"", ""57867919"")",Update table based on currentYear value from dropdown (external data),,37,,,,,
"=HYPERLINK(""https://stackoverflow.com/q/57873246"", ""57873246"")",Sharing powerapps application to multiple users,,39,,,,,
"=HYPERLINK(""https://stackoverflow.com/q/57879053"", ""57879053"")",Displaying Image from FeedItem in Custom Lightning Web Component,,95,,,,,
"=HYPERLINK(""https://stackoverflow.com/q/57885314"", ""57885314"")",Null on Foreign Key,,55,,,,,
"=HYPERLINK(""https://stackoverflow.com/q/57885877"", ""57885877"")",Select a record and change the value,,41,,,,,
"=HYPERLINK(""https://stackoverflow.com/q/57887686"", ""57887686"")",Filter a PowerApps Data source for BrowseGallery based on Sharepoint column,,137,,,,,
"=HYPERLINK(""https://stackoverflow.com/q/57891475"", ""57891475"")","Is there a way to populate a table using powerapps that is a ""new"" product",,37,,,,,
"=HYPERLINK(""https://stackoverflow.com/q/57892682"", ""57892682"")",Reassign a namespace in the same dev org,,11,,,,,
"=HYPERLINK(""https://stackoverflow.com/q/57892931"", ""57892931"")",Integrate url parameters,,26,,,,,
"=HYPERLINK(""https://stackoverflow.com/q/57894957"", ""57894957"")",Dynamic spring boot property values for salesforce connector,,20,,,,,
"=HYPERLINK(""https://stackoverflow.com/q/57895035"", ""57895035"")",Powerapps Explorer Dialogue to allow file selection,,76,,,,,
"=HYPERLINK(""https://stackoverflow.com/q/57895348"", ""57895348"")",Update 2 fields onValueChange?,,32,,,,,
"=HYPERLINK(""https://stackoverflow.com/q/57897359"", ""57897359"")",How to connect two datasources to a related third datasource in client script?,,38,,,,,
"=HYPERLINK(""https://stackoverflow.com/q/57900028"", ""57900028"")",Mendix iFrame - Page not found,,64,,,,,
"=HYPERLINK(""https://stackoverflow.com/q/57901336"", ""57901336"")",How can we use PHPMailer with Zoho oAuth?,,37,,,,,
"=HYPERLINK(""https://stackoverflow.com/q/57909595"", ""57909595"")",Power BI Dataset(or few columns) into Power Apps,,154,,,,,
"=HYPERLINK(""https://stackoverflow.com/q/57910501"", ""57910501"")",Determine whether a list item is a parent or child task in a sharepoint task list and modify its appearance in a powerapp gallery as a result,,147,,,,,
"=HYPERLINK(""https://stackoverflow.com/q/57916211"", ""57916211"")",Why can't I rename SharepointForm1 to something else?,,52,,,,,
"=HYPERLINK(""https://stackoverflow.com/q/57918783"", ""57918783"")",How to authenticate indeed request using X-Indeed-Signature?,,50,,,,,
"=HYPERLINK(""https://stackoverflow.com/q/57927698"", ""57927698"")",Hide/show Button in LWC,,1376,,,,,
"=HYPERLINK(""https://stackoverflow.com/q/57928329"", ""57928329"")",Removing focus from first record in table widget?,1.0,24,,,,,
"=HYPERLINK(""https://stackoverflow.com/q/57931047"", ""57931047"")",Is there a way to create the type of line graph described below in QuickBase?,,49,,,,,
"=HYPERLINK(""https://stackoverflow.com/q/57941287"", ""57941287"")",How to get users first and last name?,,47,,,,,
"=HYPERLINK(""https://stackoverflow.com/q/57944759"", ""57944759"")",Finding the Size of a Model in Google App Maker,1.0,41,,,,,
"=HYPERLINK(""https://stackoverflow.com/q/57958985"", ""57958985"")",convert date from DateBox to simpleDate and get year in app maker,,35,,,,,
"=HYPERLINK(""https://stackoverflow.com/q/57963215"", ""57963215"")",Having an issue with my visualforce override,,19,,,,,
"=HYPERLINK(""https://stackoverflow.com/q/57969107"", ""57969107"")",Click method is not working on a Salesforce webpage after the new update of Chromedriver. How to handle this with the same method?,1.0,66,,,,,
"=HYPERLINK(""https://stackoverflow.com/q/57971560"", ""57971560"")",How to change extension type in Add Image control Powerapps,,37,,,,,
"=HYPERLINK(""https://stackoverflow.com/q/57977027"", ""57977027"")",QuickBase AddRecord API Call,,166,,,,,
"=HYPERLINK(""https://stackoverflow.com/q/57978754"", ""57978754"")",Is there a way to filter datatable using multiple dropbox that uses sharepoint choices,,32,,,,,
"=HYPERLINK(""https://stackoverflow.com/q/57982913"", ""57982913"")",Aura root component not handling the application event started from its child (Lightning Component),,222,,,,,
"=HYPERLINK(""https://stackoverflow.com/q/57984097"", ""57984097"")",Navigate from one LWC to another LWC,,2120,,,,,
"=HYPERLINK(""https://stackoverflow.com/q/57996119"", ""57996119"")",How do you use query.filters.FulllName._contains on the Directory Model,,59,,,,,
"=HYPERLINK(""https://stackoverflow.com/q/57996398"", ""57996398"")",Delete data in table row?,,29,,,,,
"=HYPERLINK(""https://stackoverflow.com/q/58004108"", ""58004108"")",Unable to import date data into App Maker,,46,,,,,
"=HYPERLINK(""https://stackoverflow.com/q/58004855"", ""58004855"")",Integrating GitLab-CI with SalesForce Chatter,,13,,,,,
"=HYPERLINK(""https://stackoverflow.com/q/58010768"", ""58010768"")",How to use fieldset in lightning Component,,415,,,,,
"=HYPERLINK(""https://stackoverflow.com/q/58011656"", ""58011656"")","Zoho Rest Invoice API Return 400 Error, Java HttpClient",,76,,,,,
"=HYPERLINK(""https://stackoverflow.com/q/58018611"", ""58018611"")",Not displayed. vuejs with lightning-container,0.0,31,,,,,
"=HYPERLINK(""https://stackoverflow.com/q/58018964"", ""58018964"")",Set datatable column width (lightning community),,924,,,,,
"=HYPERLINK(""https://stackoverflow.com/q/58020564"", ""58020564"")",Unable to locate svg elements using xpath,,155,,,,,
"=HYPERLINK(""https://stackoverflow.com/q/58025822"", ""58025822"")",app maker: bind dropdown value to two datasource properties,,48,,,,,
"=HYPERLINK(""https://stackoverflow.com/q/58028882"", ""58028882"")",Issue facing while loading 3rd party Jquery library in lightning component,,395,,,,,
"=HYPERLINK(""https://stackoverflow.com/q/58030372"", ""58030372"")",Salesforce - Re-direct to Quick Action,,9,,,,,
"=HYPERLINK(""https://stackoverflow.com/q/58031932"", ""58031932"")",How to update a field based on the success of email sending,,38,,,,,
"=HYPERLINK(""https://stackoverflow.com/q/58032332"", ""58032332"")",Why does Selenium ExecuteScript method doesn't work anymore in Salesforce application but ExecuteAsyncScript works,,245,,,,,
"=HYPERLINK(""https://stackoverflow.com/q/58036007"", ""58036007"")",lightning component disable all other check-boxes when one is selected and post the selected image data to another lightning page,,333,,,,,
"=HYPERLINK(""https://stackoverflow.com/q/58039038"", ""58039038"")",Adding multiple owners for Google App Maker records,2.0,246,,,,,
"=HYPERLINK(""https://stackoverflow.com/q/58041573"", ""58041573"")",How to skip the login page of Salesforce?,1.0,95,,,,,
"=HYPERLINK(""https://stackoverflow.com/q/58053093"", ""58053093"")",Can't get the Object Array into Controller Function called from the Aura Component <ui:InputNumber>,,226,,,,,
"=HYPERLINK(""https://stackoverflow.com/q/58054024"", ""58054024"")",How to pass external rest api data to a model as an Array of records?,,64,,,,,
"=HYPERLINK(""https://stackoverflow.com/q/58054575"", ""58054575"")",Redirect to Zoho matched Customer Record with Deluge function,,240,,,,,
"=HYPERLINK(""https://stackoverflow.com/q/58058193"", ""58058193"")",What are the access levels on Salesforce orgs? How to get retrive Managed Package metadata?,,12,,,,,
"=HYPERLINK(""https://stackoverflow.com/q/58059973"", ""58059973"")",Cascading Lookup List,,32,,,,,
"=HYPERLINK(""https://stackoverflow.com/q/58072710"", ""58072710"")",Selenium throwing null pointer for wait.until,,368,,,,,
"=HYPERLINK(""https://stackoverflow.com/q/58074597"", ""58074597"")","How to fix the ""Required"" field in powerapps?",,88,,,,,
"=HYPERLINK(""https://stackoverflow.com/q/58081210"", ""58081210"")",Salesforce Lightning Flow Builder lookup Error,,1020,,,,,
"=HYPERLINK(""https://stackoverflow.com/q/58081651"", ""58081651"")",From Salesforce application need to send SMS/Message on Pager/Cell using Microsoft Graph API,,28,,,,,
"=HYPERLINK(""https://stackoverflow.com/q/58082775"", ""58082775"")",Combining hour and minute field into one in SharePoint list,1.0,60,,,,,
"=HYPERLINK(""https://stackoverflow.com/q/58083482"", ""58083482"")",Can a PowerApps connection to an SQL Server database in a model-driven application be bidirectional?,1.0,288,,,,,
"=HYPERLINK(""https://stackoverflow.com/q/58090624"", ""58090624"")",How do I authenticate the Salesforce token in Laravel?,,91,,,,,
"=HYPERLINK(""https://stackoverflow.com/q/58090993"", ""58090993"")",salesforce opportunity insight,,11,,,,,
"=HYPERLINK(""https://stackoverflow.com/q/58091962"", ""58091962"")",Making HTTPS POST call is not working in AWS production env,,78,,,,,
"=HYPERLINK(""https://stackoverflow.com/q/58094733"", ""58094733"")",How do i filter empty column in powerapps,,58,,,,,
"=HYPERLINK(""https://stackoverflow.com/q/58097200"", ""58097200"")",Changing polygon points in SVG for radar chart in Microsoft Powerapps,,95,,,,,
"=HYPERLINK(""https://stackoverflow.com/q/58101336"", ""58101336"")",How to pass event into a debounce function?,1.0,286,,,,,
"=HYPERLINK(""https://stackoverflow.com/q/58101720"", ""58101720"")",Appmaker: How can I create and access global variables?,,132,,,,,
"=HYPERLINK(""https://stackoverflow.com/q/58101949"", ""58101949"")",Resizing a div by the left and right border in lightning component?,,36,,,,,
"=HYPERLINK(""https://stackoverflow.com/q/58102357"", ""58102357"")",Call app maker server script from Google Sheets,,61,,,,,
"=HYPERLINK(""https://stackoverflow.com/q/58102675"", ""58102675"")",ZOHO CRM (SDK) using Laravel: How to make Authentication request initializing the Zoho SDK and store the Access Token for one session?,,92,,,,,
"=HYPERLINK(""https://stackoverflow.com/q/58109112"", ""58109112"")",Exception: Authorization Failed. More information: Unable to fetch tokens for CloudSql connection,,29,,,,,
"=HYPERLINK(""https://stackoverflow.com/q/58111227"", ""58111227"")",CSS style not applying on dynamically injected html elements in LWC,,209,,,,,
"=HYPERLINK(""https://stackoverflow.com/q/58112894"", ""58112894"")",Material-ui for PowerApps?,,226,,,,,
"=HYPERLINK(""https://stackoverflow.com/q/58114590"", ""58114590"")",Getting Bad request 400 upon rest post request from apex but works good in using postman,,139,,,,,
"=HYPERLINK(""https://stackoverflow.com/q/58115925"", ""58115925"")",How to submit html form from API Nodejs + Expressjs,,69,,,,,
"=HYPERLINK(""https://stackoverflow.com/q/58116800"", ""58116800"")",how do I get the query string parameters in lightning component salesforce,,678,,,,,
"=HYPERLINK(""https://stackoverflow.com/q/58118210"", ""58118210"")",Using RxJs with LWC in Salesforce,,135,,,,,
"=HYPERLINK(""https://stackoverflow.com/q/58118966"", ""58118966"")",Call search function when user is done Typing,,95,,,,,
"=HYPERLINK(""https://stackoverflow.com/q/58124237"", ""58124237"")",Google App Maker navigate to page while getting page name from data model,1.0,57,,,,,
"=HYPERLINK(""https://stackoverflow.com/q/58134573"", ""58134573"")",Adding google analytics data it Zoho CRM leads information,,98,,,,,
"=HYPERLINK(""https://stackoverflow.com/q/58143160"", ""58143160"")",Call a link from APEX,,74,,,,,
"=HYPERLINK(""https://stackoverflow.com/q/58143390"", ""58143390"")",Insert rows to SQL Server from Microsoft Flow,,562,,,,,
"=HYPERLINK(""https://stackoverflow.com/q/58144437"", ""58144437"")",Apex salesforce pagereference for URL link mergefield,,60,,,,,
"=HYPERLINK(""https://stackoverflow.com/q/58148161"", ""58148161"")",Have to double Click to get Selected in Aura Components,,68,,,,,
"=HYPERLINK(""https://stackoverflow.com/q/58148729"", ""58148729"")",Add widget to a layout when button was clicked (Google App Maker),,22,,,,,
"=HYPERLINK(""https://stackoverflow.com/q/58151144"", ""58151144"")",Set up a domain name for Google app maker,2.0,88,,,,,
"=HYPERLINK(""https://stackoverflow.com/q/58155631"", ""58155631"")",external jquery library not loading into lightning salesforce project,,179,,,,,
"=HYPERLINK(""https://stackoverflow.com/q/58161171"", ""58161171"")",First day of every week in every month in PowerApps,,369,,,,,
"=HYPERLINK(""https://stackoverflow.com/q/58163017"", ""58163017"")",Selenium getAttribute(href) return null value using java - Salesforce application,,158,,,,,
"=HYPERLINK(""https://stackoverflow.com/q/58170140"", ""58170140"")",How to remove error: self signed certificate in certificate chain for Node.js Mail Sender for Zoho Mail,,97,,,,,
"=HYPERLINK(""https://stackoverflow.com/q/58172015"", ""58172015"")",Alter DatacardValue with Slider and vice versa in PowerApps,,116,,,,,
"=HYPERLINK(""https://stackoverflow.com/q/58174411"", ""58174411"")",Many-to-Many Relation Table Reference in Calculated SQL Query - App Maker,2.0,123,,,,,
"=HYPERLINK(""https://stackoverflow.com/q/58177425"", ""58177425"")",Filter only data associated to my Email address in the table (Google App Maker),,40,,,,,
"=HYPERLINK(""https://stackoverflow.com/q/58181033"", ""58181033"")",Appmaker: How to validate my data on the server-side before creating a record?,,36,,,,,
"=HYPERLINK(""https://stackoverflow.com/q/58182689"", ""58182689"")",How to send data from table to popup,,62,,,,,
"=HYPERLINK(""https://stackoverflow.com/q/58184044"", ""58184044"")",How can I open a c:// folder of file or documents in powerapps,,169,,,,,
"=HYPERLINK(""https://stackoverflow.com/q/58185005"", ""58185005"")","LWC test using jest testing framework throws error - unknown public property ""smalldevicesize"" of element",1.0,142,,,,,
"=HYPERLINK(""https://stackoverflow.com/q/58200678"", ""58200678"")",Appmaker Reloading datasource on onInputChange event issue,,43,,,,,
"=HYPERLINK(""https://stackoverflow.com/q/58205324"", ""58205324"")",Vehicle Booking System,,61,,,,,
"=HYPERLINK(""https://stackoverflow.com/q/58205707"", ""58205707"")",Only able to access first record in a query,,30,,,,,
"=HYPERLINK(""https://stackoverflow.com/q/58207245"", ""58207245"")",selenium.WebDriverException: Returned value cannot be converted to WebElement,,369,,,,,
"=HYPERLINK(""https://stackoverflow.com/q/58218403"", ""58218403"")",How to apply query / filter on a datasource related to the currently selected datasource?,,85,,,,,
"=HYPERLINK(""https://stackoverflow.com/q/58221451"", ""58221451"")",App maker override server side error message,,61,,,,,
"=HYPERLINK(""https://stackoverflow.com/q/58221749"", ""58221749"")",One to Many lookup field in Form,1.0,81,,,,,
"=HYPERLINK(""https://stackoverflow.com/q/58222198"", ""58222198"")",Auto populate per user information from a SharePoint List,,356,,,,,
"=HYPERLINK(""https://stackoverflow.com/q/58224388"", ""58224388"")","AppMaker error say ""The instance must be a 2nd generation SQL database"" but it is a 2nd gen",,88,,,,,
"=HYPERLINK(""https://stackoverflow.com/q/58227669"", ""58227669"")",Preview mode show data byt publish shows no data,,28,,,,,
"=HYPERLINK(""https://stackoverflow.com/q/58229641"", ""58229641"")",Fetch the Target record in NodeList using Lightning component,1.0,10,,,,,
"=HYPERLINK(""https://stackoverflow.com/q/58232113"", ""58232113"")",How to input data to foreign field?,,43,,,,,
"=HYPERLINK(""https://stackoverflow.com/q/58248640"", ""58248640"")",client id for multiple users issue with zoho integration,,25,,,,,
"=HYPERLINK(""https://stackoverflow.com/q/58249552"", ""58249552"")",Do we have any event in lightning that fires after all the child components of a parent component has rendered?,,41,,,,,
"=HYPERLINK(""https://stackoverflow.com/q/58251535"", ""58251535"")",com.google.apps.appmaker.shared.json.JsonException: JSON is not an object,0.0,44,,,,,
"=HYPERLINK(""https://stackoverflow.com/q/58251999"", ""58251999"")",How to implement client side pagination on json response with images URLs in Lightning?,,56,,,,,
"=HYPERLINK(""https://stackoverflow.com/q/58252971"", ""58252971"")",OneNote nested list issues when creating page from PowerApps,,57,,,,,
"=HYPERLINK(""https://stackoverflow.com/q/58255162"", ""58255162"")",unable to create zoho oauth client id with global scope,,94,,,,,
"=HYPERLINK(""https://stackoverflow.com/q/58264615"", ""58264615"")",How to get Field Id from URL when creating new record from Related list in Salesforce,,21,,,,,
"=HYPERLINK(""https://stackoverflow.com/q/58270907"", ""58270907"")",How to integrate zoho 'Mobilisten' to xcode 11,,33,,,,,
"=HYPERLINK(""https://stackoverflow.com/q/58273933"", ""58273933"")",How to incorporate Html in client script code?,1.0,32,,,,,
"=HYPERLINK(""https://stackoverflow.com/q/58275712"", ""58275712"")",How to convert lightning web component into pdf on buttom click,,16,,,,,
"=HYPERLINK(""https://stackoverflow.com/q/58281244"", ""58281244"")",Attempting to access Appian documents using C# and web-api's,,74,,,,,
"=HYPERLINK(""https://stackoverflow.com/q/58289430"", ""58289430"")",Salesforce: How to get field value in aura attribute and use if statement in component,,1256,,,,,
"=HYPERLINK(""https://stackoverflow.com/q/58289560"", ""58289560"")",Salesforce login to user with lightning design - No headers,,34,,,,,
"=HYPERLINK(""https://stackoverflow.com/q/58292569"", ""58292569"")","How to calculate if Date is more than ""2 years ago"" with a Salesforce formula field?",,485,,,,,
"=HYPERLINK(""https://stackoverflow.com/q/58293197"", ""58293197"")",PowerApps patch a datasource from a collection,,832,,,,,
"=HYPERLINK(""https://stackoverflow.com/q/58294034"", ""58294034"")",How to create a collection from Office365.Outlook data source?,,48,,,,,
"=HYPERLINK(""https://stackoverflow.com/q/58296033"", ""58296033"")",How to link DataCardValue to another view,,30,,,,,
"=HYPERLINK(""https://stackoverflow.com/q/58297072"", ""58297072"")",Issue with relation when creating record,,79,,,,,
"=HYPERLINK(""https://stackoverflow.com/q/58300168"", ""58300168"")",loading community url on ios webview after login to salesforce mobile sdk,,34,,,,,
"=HYPERLINK(""https://stackoverflow.com/q/58302431"", ""58302431"")",Update ChildRecords when Parent Field Update Using Lightning Flow,,9,,,,,
"=HYPERLINK(""https://stackoverflow.com/q/58303923"", ""58303923"")","Advantage JDBC , Unexpected EOF while reading from socket?",,51,,,,,
"=HYPERLINK(""https://stackoverflow.com/q/58307208"", ""58307208"")",PowerApps global variable not updating when record changed,,264,,,,,
"=HYPERLINK(""https://stackoverflow.com/q/58316719"", ""58316719"")",Customize (OutSystems App Feedback) in Feedback Screen in Outsystems mobile,,23,,,,,
