Id,Title,FavoriteCount,ViewCount,tag1,Tag2,Tag3,Tag4,isProblematic
"=HYPERLINK(""https://stackoverflow.com/q/52088202"", ""52088202"")",Relation Filtering,,129,,,,,
"=HYPERLINK(""https://stackoverflow.com/q/52088852"", ""52088852"")","How to prepopulate entries for a SQL table, so that a first time user gets sample data?",,42,,,,,
"=HYPERLINK(""https://stackoverflow.com/q/52098303"", ""52098303"")",Unable to execute automation Test scripts wrote for Salesforce classic on Salesforce lightning using selenium web driver,,338,,,,,
"=HYPERLINK(""https://stackoverflow.com/q/52120970"", ""52120970"")",Display an image that's uploaded into app resources,,72,,,,,
"=HYPERLINK(""https://stackoverflow.com/q/52126309"", ""52126309"")",Conditional formatting in AppMaker table,1.0,557,,,,,
"=HYPERLINK(""https://stackoverflow.com/q/52133532"", ""52133532"")",Table with rows of variable height,,51,,,,,
"=HYPERLINK(""https://stackoverflow.com/q/52143938"", ""52143938"")",PowerApps embedded in Power Bi Desktop communication to Local SQL Server without on Premises,,157,,,,,
"=HYPERLINK(""https://stackoverflow.com/q/52144189"", ""52144189"")",How can we use web workers of JS in salesforce lightning UI?,0.0,234,,,,,
"=HYPERLINK(""https://stackoverflow.com/q/52144934"", ""52144934"")",Zoho Deluge : How can I insert line breaks or start a new line to e-mail message?,,642,,,,,
"=HYPERLINK(""https://stackoverflow.com/q/52145113"", ""52145113"")",Zoho Deluge : How to send an Email,,970,,,,,
"=HYPERLINK(""https://stackoverflow.com/q/52154790"", ""52154790"")",Access value from a list row from a script in App Maker,1.0,444,,,,,
"=HYPERLINK(""https://stackoverflow.com/q/52163958"", ""52163958"")",Parse/Decode response (Json format?) - PHP Curl,,454,,,,,
"=HYPERLINK(""https://stackoverflow.com/q/52186852"", ""52186852"")",How to insert lightning component to visualforce page with apex after button click,,357,,,,,
"=HYPERLINK(""https://stackoverflow.com/q/52187749"", ""52187749"")",Select field from SQL Datasource in Google App Maker based on drop down value,,339,,,,,
"=HYPERLINK(""https://stackoverflow.com/q/52191591"", ""52191591"")",Multiple Selections in a Combobox,,85,,,,,
"=HYPERLINK(""https://stackoverflow.com/q/52194258"", ""52194258"")",Google App Maker Table object only displays Date not DateTime,,187,,,,,
"=HYPERLINK(""https://stackoverflow.com/q/52201545"", ""52201545"")",Error while loading library mapsjs-core and mapsjs-service in salesforce lightning,,86,,,,,
"=HYPERLINK(""https://stackoverflow.com/q/52205477"", ""52205477"")",Loading troubles in powerapps,,218,,,,,
"=HYPERLINK(""https://stackoverflow.com/q/52205799"", ""52205799"")",How to export schema of a database in AppMaker,,80,,,,,
"=HYPERLINK(""https://stackoverflow.com/q/52213181"", ""52213181"")",Sharing source files between Client and Server side on AppMaker,1.0,44,,,,,
"=HYPERLINK(""https://stackoverflow.com/q/52213870"", ""52213870"")",AppMaker: example of a transaction,,103,,,,,
"=HYPERLINK(""https://stackoverflow.com/q/52215513"", ""52215513"")",How can I get grid-cell-collections from grid object?,,105,,,,,
"=HYPERLINK(""https://stackoverflow.com/q/52215703"", ""52215703"")",MS Powerapps: Forall in combination with Office365.SendEmail,,295,,,,,
"=HYPERLINK(""https://stackoverflow.com/q/52217414"", ""52217414"")",PowerApps Gallery not showing SharePoint data for users,,584,,,,,
"=HYPERLINK(""https://stackoverflow.com/q/52223085"", ""52223085"")",Use PowerApp to enter the user's input into the word document.,,427,,,,,
"=HYPERLINK(""https://stackoverflow.com/q/52224883"", ""52224883"")",How to Check value of combo-box (selected items) in the formula for a button (Visible property),,425,,,,,
"=HYPERLINK(""https://stackoverflow.com/q/52242599"", ""52242599"")",Can NLP algorithm run on Force.com platform?,2.0,19,,,,,
"=HYPERLINK(""https://stackoverflow.com/q/52260506"", ""52260506"")","PowerApps: 3 keys were specified, but 4 values were provided",,475,,,,,
"=HYPERLINK(""https://stackoverflow.com/q/52261990"", ""52261990"")",Create records in AppMaker from email,,142,,,,,
"=HYPERLINK(""https://stackoverflow.com/q/52264141"", ""52264141"")",Rounding binding expressions appmaker,,107,,,,,
"=HYPERLINK(""https://stackoverflow.com/q/52282777"", ""52282777"")",Validation trouble on new records,,37,,,,,
"=HYPERLINK(""https://stackoverflow.com/q/52287773"", ""52287773"")",Showing error in Search Command Power Apps,,45,,,,,
"=HYPERLINK(""https://stackoverflow.com/q/52288990"", ""52288990"")",Apply search and filter in power Apps,,2795,,,,,
"=HYPERLINK(""https://stackoverflow.com/q/52290270"", ""52290270"")",Choose form at opening,,26,,,,,
"=HYPERLINK(""https://stackoverflow.com/q/52294271"", ""52294271"")",Update a record in the ZohoCRM using PHP SDK based on ID,,493,,,,,
"=HYPERLINK(""https://stackoverflow.com/q/52294548"", ""52294548"")",Use a field in a list without use it in a datacard visible on form,,44,,,,,
"=HYPERLINK(""https://stackoverflow.com/q/52294863"", ""52294863"")",powerapp adding changing hyperlinks,,220,,,,,
"=HYPERLINK(""https://stackoverflow.com/q/52296498"", ""52296498"")",Zoho Creator -- Get calendar date from calendar report and paste into another form,,155,,,,,
"=HYPERLINK(""https://stackoverflow.com/q/52299979"", ""52299979"")",lightning component CSP is preventing me from use inline base64 data for audio tags,,227,,,,,
"=HYPERLINK(""https://stackoverflow.com/q/52300209"", ""52300209"")",Correct Usage Of Groups For Permissions,,235,,,,,
"=HYPERLINK(""https://stackoverflow.com/q/52316754"", ""52316754"")",Google App Maker How to Allow access to user to your App Instance who don't have Gsuite,1.0,455,,,,,
"=HYPERLINK(""https://stackoverflow.com/q/52325612"", ""52325612"")",How to add google sheet excel column values to dropdown in power apps,,357,,,,,
"=HYPERLINK(""https://stackoverflow.com/q/52332025"", ""52332025"")",Field growing when text incoming,,37,,,,,
"=HYPERLINK(""https://stackoverflow.com/q/52353918"", ""52353918"")",How to get Google UserId from active user session in App Maker?,,789,,,,,
"=HYPERLINK(""https://stackoverflow.com/q/52363765"", ""52363765"")",Powerapps Search all even if filtered,,71,,,,,
"=HYPERLINK(""https://stackoverflow.com/q/52370349"", ""52370349"")",Need to compare value with custom field of pick list datatype in SFDC,,561,,,,,
"=HYPERLINK(""https://stackoverflow.com/q/52370474"", ""52370474"")",AppMaker table missing rows,,26,,,,,
"=HYPERLINK(""https://stackoverflow.com/q/52370526"", ""52370526"")",Integration of Zoho CRM and Moodle,,235,,,,,
"=HYPERLINK(""https://stackoverflow.com/q/52406269"", ""52406269"")",Powerapps - Variables in gallery,,1284,,,,,
"=HYPERLINK(""https://stackoverflow.com/q/52406753"", ""52406753"")",Create Table in Google Docs with App Maker,,157,,,,,
"=HYPERLINK(""https://stackoverflow.com/q/52421026"", ""52421026"")",Zoho JSON result into CSV file,,39,,,,,
"=HYPERLINK(""https://stackoverflow.com/q/52424944"", ""52424944"")","how to filter powerapp gallery with textinput, dropdown, and datepicker",,1699,,,,,
"=HYPERLINK(""https://stackoverflow.com/q/52425738"", ""52425738"")",Form is submitting empty values though it's required in the datasource (Google App Maker),,43,,,,,
"=HYPERLINK(""https://stackoverflow.com/q/52427085"", ""52427085"")",Restrict access to page via script Appmaker,,45,,,,,
"=HYPERLINK(""https://stackoverflow.com/q/52436007"", ""52436007"")","OneDrive App on iOS - Launch to a specific folder, from PowerApps",,259,,,,,
"=HYPERLINK(""https://stackoverflow.com/q/52441440"", ""52441440"")",Get email address from directory with Full name in appmaker,,337,,,,,
"=HYPERLINK(""https://stackoverflow.com/q/52443062"", ""52443062"")",How to check if a Choice field option is selected,,1701,,,,,
"=HYPERLINK(""https://stackoverflow.com/q/52480985"", ""52480985"")",AppMaker - Navigate to Last Page on Table,,367,,,,,
"=HYPERLINK(""https://stackoverflow.com/q/52486527"", ""52486527"")",How to populate user avatar image in App Maker project?,,286,,,,,
"=HYPERLINK(""https://stackoverflow.com/q/52492264"", ""52492264"")",File upload to zoho contacts in C#.Net,,197,,,,,
"=HYPERLINK(""https://stackoverflow.com/q/52497823"", ""52497823"")",Dynamically create widgets based on records in a datasource,,362,,,,,
"=HYPERLINK(""https://stackoverflow.com/q/52498140"", ""52498140"")",Is it possible to call methods dynamically?,,103,,,,,
"=HYPERLINK(""https://stackoverflow.com/q/52499067"", ""52499067"")",Update records Zoho api v2 symbols,,222,,,,,
"=HYPERLINK(""https://stackoverflow.com/q/52510724"", ""52510724"")",How to get Zoho Books Contact by zcrm_vendor_id,1.0,239,,,,,
"=HYPERLINK(""https://stackoverflow.com/q/52518944"", ""52518944"")",Is it possible to apply conditional formatting in Google App Maker?,,347,,,,,
"=HYPERLINK(""https://stackoverflow.com/q/52519202"", ""52519202"")",Create Dynamic UI (Input Form) from API Response in a Mobile App Developed Using OutSystems Platform,,311,,,,,
"=HYPERLINK(""https://stackoverflow.com/q/52525320"", ""52525320"")",How to use the SalesForce API?,,414,,,,,
"=HYPERLINK(""https://stackoverflow.com/q/52529279"", ""52529279"")",Access JSON results from Custom Connector (Web API) in PowerApps,,3324,,,,,
"=HYPERLINK(""https://stackoverflow.com/q/52534581"", ""52534581"")",Zoho OAuth 2.0 Refresh token multiple times,,647,,,,,
"=HYPERLINK(""https://stackoverflow.com/q/52544025"", ""52544025"")",How to remember page in table when navigating back,,41,,,,,
"=HYPERLINK(""https://stackoverflow.com/q/52559551"", ""52559551"")",App Maker- Issues while trying to retrieve a list of all users in my department,,241,,,,,
"=HYPERLINK(""https://stackoverflow.com/q/52563232"", ""52563232"")",Can you create a browser app with PowerApps?,,563,,,,,
"=HYPERLINK(""https://stackoverflow.com/q/52574490"", ""52574490"")","Problem with Zoho Invocing API {""code"":1038,""message"":""JSON is not well formed}",,451,,,,,
"=HYPERLINK(""https://stackoverflow.com/q/52585467"", ""52585467"")",Connecting Azure blob storage to PowerApps,,558,,,,,
"=HYPERLINK(""https://stackoverflow.com/q/52593036"", ""52593036"")",Gmail Quota Reached in AppMaker,,62,,,,,
"=HYPERLINK(""https://stackoverflow.com/q/52600010"", ""52600010"")",PowerApps Common Data Service (CDS) 2.0 connector doesn't work for a Dynamics 365 CE instance,1.0,991,,,,,
"=HYPERLINK(""https://stackoverflow.com/q/52605791"", ""52605791"")",Return a value from Calculated Model Table in Google App Maker,,180,,,,,
"=HYPERLINK(""https://stackoverflow.com/q/52612424"", ""52612424"")",Lightning - Thousand Comma Separators for Picklist labels,,74,,,,,
"=HYPERLINK(""https://stackoverflow.com/q/52626952"", ""52626952"")",PowerApps out of office different user,,73,,,,,
"=HYPERLINK(""https://stackoverflow.com/q/52642674"", ""52642674"")",Date mismatch in form selection and table in App Maker,,98,,,,,
"=HYPERLINK(""https://stackoverflow.com/q/52648963"", ""52648963"")",How to Make a Timer App Using Outsystems?,,101,,,,,
"=HYPERLINK(""https://stackoverflow.com/q/52656748"", ""52656748"")",2GP packages in Salesforce production?,,44,,,,,
"=HYPERLINK(""https://stackoverflow.com/q/52668100"", ""52668100"")",Server Script calling an external source returns object error,,65,,,,,
"=HYPERLINK(""https://stackoverflow.com/q/52670156"", ""52670156"")",HERE map is blank in outsystems,,169,,,,,
"=HYPERLINK(""https://stackoverflow.com/q/52673505"", ""52673505"")",Nested If Formula in a forAll formula in a forAll formula PowerApps,,1293,,,,,
"=HYPERLINK(""https://stackoverflow.com/q/52684091"", ""52684091"")","Lightning:overlayLib, override 'overflow:hidden' property to 'overflow:visible'",,562,,,,,
"=HYPERLINK(""https://stackoverflow.com/q/52704291"", ""52704291"")",Unable to set value dynamically for Lightning:InputField,,11776,,,,,
"=HYPERLINK(""https://stackoverflow.com/q/52706803"", ""52706803"")",Creating folders using DriveApp.createFolder gives duplicates,,88,,,,,
"=HYPERLINK(""https://stackoverflow.com/q/52715914"", ""52715914"")",sharepoint online - Powerapp integration,,52,,,,,
"=HYPERLINK(""https://stackoverflow.com/q/52719697"", ""52719697"")",AppMaker - Display only Filtered Items in Tabs,,106,,,,,
"=HYPERLINK(""https://stackoverflow.com/q/52720455"", ""52720455"")",Only allow editable = true on specific events in FullCalendar,,623,,,,,
"=HYPERLINK(""https://stackoverflow.com/q/52733497"", ""52733497"")",How to add and edit record directly on the table widget Google AppMaker?,,423,,,,,
"=HYPERLINK(""https://stackoverflow.com/q/52736363"", ""52736363"")",Microsoft flow not triggering when new email is arrived,,879,,,,,
"=HYPERLINK(""https://stackoverflow.com/q/52737691"", ""52737691"")",Embed a TradingView widget into google app maker,,45,,,,,
"=HYPERLINK(""https://stackoverflow.com/q/52744026"", ""52744026"")",Incorporating responsive design in Google App Maker,,394,UI customization [Design flexibility|  UI Overflow| Show/Hide Component|],,,,
"=HYPERLINK(""https://stackoverflow.com/q/52753965"", ""52753965"")",How do I get the correct datasource setup in app-maker?,,47,,,,,
"=HYPERLINK(""https://stackoverflow.com/q/52761661"", ""52761661"")",Is possible to integrate Bootstrap in App Maker?,,197,,,,,
"=HYPERLINK(""https://stackoverflow.com/q/52762374"", ""52762374"")",PowerApps : Implementing Role Based Security In Your PowerApps App,,2471,Developer role management [Collaboration | Developer role assignment],,,,
"=HYPERLINK(""https://stackoverflow.com/q/52764400"", ""52764400"")",lightning:input Date Field validation,,4690,,,,,
"=HYPERLINK(""https://stackoverflow.com/q/52772128"", ""52772128"")",PowerApps: How to Patch multiple SQL tables with foreign keys?,,1242,,,,,
"=HYPERLINK(""https://stackoverflow.com/q/52776119"", ""52776119"")",Query datasource referencing other datasources,,238,,,,,
"=HYPERLINK(""https://stackoverflow.com/q/52781309"", ""52781309"")",Dropdown with Icon in Salesforce Lightning Component,,967,,,,,
"=HYPERLINK(""https://stackoverflow.com/q/52805378"", ""52805378"")",google.script.run XX is not a function error,,689,,,,,
"=HYPERLINK(""https://stackoverflow.com/q/52814608"", ""52814608"")",google appmaker filter dropdown,1.0,740,,,,,
"=HYPERLINK(""https://stackoverflow.com/q/52816757"", ""52816757"")",How to track when a relation value of a record has changed using onBeforeSave event?,,49,,,,,
"=HYPERLINK(""https://stackoverflow.com/q/52821168"", ""52821168"")",Salesforce SOQL with datetime literals to pull records between 2 datetime custom fields?,,482,,,,,
"=HYPERLINK(""https://stackoverflow.com/q/52825572"", ""52825572"")","DriveApp.getFolderById :No item with the given ID could be found, or you do not have permission to access it",,369,,,,,
"=HYPERLINK(""https://stackoverflow.com/q/52831801"", ""52831801"")",Unable to build a calculated datasource from a user list request to AdminDirectory,,134,Debugging Error/crash [why this does not work| Application Code change not executed| Broken UI| Functionalities not working| boken UI| Embedding | ],,,,
"=HYPERLINK(""https://stackoverflow.com/q/52836878"", ""52836878"")",Substringing a QR code and enter automatically in a form field in Zoho,,33,Application Customization [QR code | Automatic value| Show/Hide Component| Pagination | Automatic Email | Embedding ],,,,
"=HYPERLINK(""https://stackoverflow.com/q/52838421"", ""52838421"")",The onbeforeunload event does not occur when the browser tab of appmaker web app closes,,144,,,,,
"=HYPERLINK(""https://stackoverflow.com/q/52840363"", ""52840363"")",Google app maker: How to list existent groups?,,343,,,,,
"=HYPERLINK(""https://stackoverflow.com/q/52843956"", ""52843956"")",Google App Maker: external javascript library,,793,,,,,
"=HYPERLINK(""https://stackoverflow.com/q/52854298"", ""52854298"")",Select a form from title when I open my app,,53,,,,,
"=HYPERLINK(""https://stackoverflow.com/q/52872674"", ""52872674"")",Printing Images To Zebra Printer,1.0,381,,,,,
"=HYPERLINK(""https://stackoverflow.com/q/52874947"", ""52874947"")",I can't embed iframes to make courses in the Appmaker training hub template,,112,,,,,
"=HYPERLINK(""https://stackoverflow.com/q/52880268"", ""52880268"")",Dynamic link to different list views within a Lightning:card component footer - Salesforce,,143,,,,,
"=HYPERLINK(""https://stackoverflow.com/q/52888222"", ""52888222"")",Life Time Api Authorization - OutSystems,,82,,,,,
"=HYPERLINK(""https://stackoverflow.com/q/52890757"", ""52890757"")",CORS request with Electron,1.0,1570,,,,,
"=HYPERLINK(""https://stackoverflow.com/q/52892670"", ""52892670"")",error publishing application could not access deployment,,34,,,,,
"=HYPERLINK(""https://stackoverflow.com/q/52894062"", ""52894062"")",Lookup always return first item,,49,,,,,
"=HYPERLINK(""https://stackoverflow.com/q/52897466"", ""52897466"")",How to pause an appmaker deployment?,,64,,,,,
"=HYPERLINK(""https://stackoverflow.com/q/52898741"", ""52898741"")",Google App Maker: Enable app to make Admin SDK API calls,,96,,,,,
"=HYPERLINK(""https://stackoverflow.com/q/52904363"", ""52904363"")",How to autogenerate Primary Name field in custom Common Data Service Entity?,,339,,,,,
"=HYPERLINK(""https://stackoverflow.com/q/52917737"", ""52917737"")","TypeError: Cannot read property ""data"" from undefined",,1955,,,,,
"=HYPERLINK(""https://stackoverflow.com/q/52919137"", ""52919137"")",Google App Maker - Creating a contract. Methods to use?,2.0,246,,,,,
"=HYPERLINK(""https://stackoverflow.com/q/52923228"", ""52923228"")",How to handle HOLD projects in Salesforce?,,96,,,,,
"=HYPERLINK(""https://stackoverflow.com/q/52939680"", ""52939680"")",How to detect an error in item creation on the client side (App Maker),,134,,,,,
"=HYPERLINK(""https://stackoverflow.com/q/52952265"", ""52952265"")",application name and apps script version,,62,,,,,
"=HYPERLINK(""https://stackoverflow.com/q/52953534"", ""52953534"")",Pseudo elements don't appear to work in Salesforce lightning CSS,,315,,,,,
"=HYPERLINK(""https://stackoverflow.com/q/52954065"", ""52954065"")",powerapps add picture modus how to add multiple,,1123,,,,,
"=HYPERLINK(""https://stackoverflow.com/q/52958536"", ""52958536"")",How can I populate an embedded website form with URL parameters using Javascript?,,95,,,,,
"=HYPERLINK(""https://stackoverflow.com/q/52960863"", ""52960863"")",Send notification to Hangout from Google AppMaker,,220,,,,,
"=HYPERLINK(""https://stackoverflow.com/q/52961393"", ""52961393"")",Google photos - no teamDriveId but API thinks it a team drive file,,58,,,,,
"=HYPERLINK(""https://stackoverflow.com/q/52975602"", ""52975602"")",Apex Test Class - Simple Insert,,425,,,,,
"=HYPERLINK(""https://stackoverflow.com/q/53008138"", ""53008138"")",Adding records onAfterCreate,,77,,,,,
"=HYPERLINK(""https://stackoverflow.com/q/53015958"", ""53015958"")",How can I dynamically update 'src' in <script src=> in Squarespace,,47,,,,,
"=HYPERLINK(""https://stackoverflow.com/q/53027157"", ""53027157"")",Zoho Api Oauth v.2 | Why does it want to sign in at the User Authorization Request?,,520,,,,,
"=HYPERLINK(""https://stackoverflow.com/q/53039094"", ""53039094"")",Display contact list images in Outsystems Mobile,,187,,,,,
"=HYPERLINK(""https://stackoverflow.com/q/53043346"", ""53043346"")","Does Mendix generates a source code in any particular language, which can be edited and reused?",,120,,,,,
"=HYPERLINK(""https://stackoverflow.com/q/53051838"", ""53051838"")","Admins do not have the ability to edit the deployment permissions, only Owner does",,32,,,,,
"=HYPERLINK(""https://stackoverflow.com/q/53082382"", ""53082382"")",Zoho API-V2 Add Attactmetn URL,1.0,222,,,,,
"=HYPERLINK(""https://stackoverflow.com/q/53082622"", ""53082622"")",How to catch an error on saveChanges - Google App Maker,1.0,458,,,,,
"=HYPERLINK(""https://stackoverflow.com/q/53095373"", ""53095373"")",Integrate ZOHO API with Laravel 5.7,,2533,,,,,
"=HYPERLINK(""https://stackoverflow.com/q/53108026"", ""53108026"")",SharePoint & PowerApps Forms ... Auto fill list field by retrieving Data from 2nd list,,1355,,,,,
"=HYPERLINK(""https://stackoverflow.com/q/53109130"", ""53109130"")","Google Domain, Zoho Email, MailGun Delivery: SPF Entries error",,62,,,,,
"=HYPERLINK(""https://stackoverflow.com/q/53110268"", ""53110268"")",(appmaker) Correctly setting up a multiselect,,225,,,,,
"=HYPERLINK(""https://stackoverflow.com/q/53115362"", ""53115362"")",Dynamically Bind Data source to app maker popup,1.0,836,,,,,
"=HYPERLINK(""https://stackoverflow.com/q/53154744"", ""53154744"")",Add array value dynamically with a specific index?,,423,,,,,
"=HYPERLINK(""https://stackoverflow.com/q/53161038"", ""53161038"")",Why do simultaneous Google web app users contaminate results,,80,,,,,
"=HYPERLINK(""https://stackoverflow.com/q/53167215"", ""53167215"")","Google App Maker, how to create copy to clipboard function",,462,,,,,
"=HYPERLINK(""https://stackoverflow.com/q/53169033"", ""53169033"")",How to take photo with Google App Maker on iOS?,,132,,,,,
"=HYPERLINK(""https://stackoverflow.com/q/53170139"", ""53170139"")",Automatic import Excel/CSV file from local pc to QuickBase without using third-party of quickbase,,141,,,,,
"=HYPERLINK(""https://stackoverflow.com/q/53170292"", ""53170292"")",Save data to text,,58,,,,,
"=HYPERLINK(""https://stackoverflow.com/q/53171048"", ""53171048"")",Appmaker fill a textbox with a default value in a create form,1.0,236,,,,,
"=HYPERLINK(""https://stackoverflow.com/q/53173969"", ""53173969"")",Google App Maker: How to access properties of an item bound to widget?,,52,,,,,
"=HYPERLINK(""https://stackoverflow.com/q/53174186"", ""53174186"")",Appmaker: Opening a page where the record is pre-selected,,422,,,,,
"=HYPERLINK(""https://stackoverflow.com/q/53175144"", ""53175144"")",Get values out of multi-select combobox,,1098,,,,,
"=HYPERLINK(""https://stackoverflow.com/q/53192185"", ""53192185"")",Edit form Selected field auto created in view mode,,67,,,,,
"=HYPERLINK(""https://stackoverflow.com/q/53192332"", ""53192332"")",PowerApps form doesn't save external data to SharePoint list,,186,,,,,
"=HYPERLINK(""https://stackoverflow.com/q/53195363"", ""53195363"")",Google App Maker: how to hide spinner programatically?,,304,,,,,
"=HYPERLINK(""https://stackoverflow.com/q/53197839"", ""53197839"")",How to have Powerapps automatically generate existing Excel dropdowns?,,70,,,,,
"=HYPERLINK(""https://stackoverflow.com/q/53199680"", ""53199680"")",AppMaker Drive.Files.list query for properties,,73,,,,,
"=HYPERLINK(""https://stackoverflow.com/q/53207169"", ""53207169"")",Save calculated records on non-calculated datasource,,104,,,,,
"=HYPERLINK(""https://stackoverflow.com/q/53207653"", ""53207653"")",Can not import .zip files in appmaker,,104,,,,,
"=HYPERLINK(""https://stackoverflow.com/q/53208833"", ""53208833"")","How can I use ListView.obj in filtering SOQL, or in filtering already queried data?",,65,,,,,
"=HYPERLINK(""https://stackoverflow.com/q/53218116"", ""53218116"")","On PowerApps, every time I save a new item, the item on the form switches to the first item on the Sharepoint list",,937,,,,,
"=HYPERLINK(""https://stackoverflow.com/q/53232272"", ""53232272"")",Lightning Component List inside Component,,476,,,,,
"=HYPERLINK(""https://stackoverflow.com/q/53244788"", ""53244788"")",Return created item key,,33,,,,,
"=HYPERLINK(""https://stackoverflow.com/q/53257076"", ""53257076"")",How to get custom roles enabled for an user in office 365 environment from powerapps,,348,,,,,
"=HYPERLINK(""https://stackoverflow.com/q/53258037"", ""53258037"")",How to access another widget on the page in appmaker from an event,,120,,,,,
"=HYPERLINK(""https://stackoverflow.com/q/53260499"", ""53260499"")",Initial query of data source,,67,,,,,
"=HYPERLINK(""https://stackoverflow.com/q/53262784"", ""53262784"")",How to get roles assigned for an user in Office 365 environment from Powerapps,,281,,,,,
"=HYPERLINK(""https://stackoverflow.com/q/53264791"", ""53264791"")",How to get MyTeams of CurrentUser in Office 365(Dynamics 365) Environment from Powerapps?,,46,,,,,
"=HYPERLINK(""https://stackoverflow.com/q/53267924"", ""53267924"")",How to browse to the next page in a datasource that is loaded into table in Google AppMaker,,253,,,,,
"=HYPERLINK(""https://stackoverflow.com/q/53279941"", ""53279941"")",Link to specific record on page in google app maker,,59,,,,,
"=HYPERLINK(""https://stackoverflow.com/q/53286917"", ""53286917"")",PowerApps attachment control how to check if any attachments have been made,,4174,,,,,
"=HYPERLINK(""https://stackoverflow.com/q/53287555"", ""53287555"")",Google app maker: How to secure sensitive data in server scripts?,,175,,,,,
"=HYPERLINK(""https://stackoverflow.com/q/53288846"", ""53288846"")","How do I view the contents of my ""default"" type Cloud SQL database in AppMaker?",,76,,,,,
"=HYPERLINK(""https://stackoverflow.com/q/53290593"", ""53290593"")",Setting G Suite user properties with App Script and the Admin SDK,,340,,,,,
"=HYPERLINK(""https://stackoverflow.com/q/53299189"", ""53299189"")",Integrate Gmail api with Google app maker,,219,,,,,
"=HYPERLINK(""https://stackoverflow.com/q/53303701"", ""53303701"")",How to use a bit data type in OutSystems,,101,,,,,
"=HYPERLINK(""https://stackoverflow.com/q/53305663"", ""53305663"")",Google App Maker: How to add pagination and sorting to a table widget bound to a calculated datasource?,,400,,,,,
"=HYPERLINK(""https://stackoverflow.com/q/53319236"", ""53319236"")",Microsoft PowerApps referencing Lookup values,,986,,,,,
"=HYPERLINK(""https://stackoverflow.com/q/53326262"", ""53326262"")",Google App Maker: how to implement pagination on table bound to a calculated model,,133,,,,,
